marketplace;marketplaceProductId;title;brand
ozon;1692653743;Светодиодные ходовые огни для автомобиля, 2 шт;veco
ozon;835717159;GETZEN Огни дневные ходовые, Светодиодная, 2 шт., арт. Дхо Led 23;getzen
ozon;189429358;Комплект светодиодных противотуманных LED фар 2 шт. 30 Вт OUTLANDER FORD FOCUS LOGAN LANCER DUSTER LADA VESTA ASX;voltOn
ozon;1145371808;Клипсы для автомобиля универсальные набор 100 шт. + 5 съёмников;mavyko
ozon;1544427517;Клипсы автомобильные, набор 100 штук;sellTi
ozon;1559885750;Автомобильные крепежные клипсы 100 шт. + инструмент для монтажа 5 шт. пистоны для крепления обшивки салона, багажника и бампера, инструменты для снятия, съемники, ремкомплект автокрепеж;browz
ozon;631663147;Клипсы автомобильные, набор 100 штук 6 видов;primeparts
ozon;1216193990;Клипсы для автомобиля, для крепления обшивки салона, багажника, набор 100 штук 6 видов + инструменты для снятия, съемники, пистоны крепежные автомобильные;avtotovarыAvtokosmetyka
ozon;1853141312;Клипсы автомобильные, набор 100 штук;allAtOnce
ozon;1328862664;Клипсы автомобильные крепежные, набор 100 шт 6 видов / метиз крепежный автомобильный;bestdiller
ozon;1145380846;Клипсы автомобильные набор 655 шт. универсальные + 5 съёмников;mavyko
ozon;1526496692;Клипсы автомобильные набор 680 штук, крепежные, 23 вида + съемник, лопатки, хомуты;primeparts
ozon;1545669714;Клипсы для автомобиля,Автомобильные клипсы набор пистоны 725шт;pabk
ozon;940559651;Набор клипс автомобильных 500 штук. 20 видов пистонов болтов, фиксаторов, заклепок, метизов крепежных пластиковых и железных.;primeparts
ozon;582968470;Клипсы автомобильные 620 штук, крепежные пластиковые 16 видов;primeparts
ozon;1415940988;Автофрейм Клипса крепежная автомобильная, 12 мм, 620 шт.;avtofreim
ozon;1166590112;Автополотенце для сушки кузова Деталиус из микрофибры супервпитывающее большое 50*60 двустороннее с мешком для хранения - 1 шт.;detalyus
ozon;1876800620;Микрофибра тряпка для сушки автомобиля 50x60;ultragloss
ozon;719003348;DomClin / Салфетка из микрофибры для авто и сушки кузова, 1 шт;domclin
ozon;2396871606;UltraClear Автополотенце, 1 шт.;ultraclear
ozon;1419428657;Реснин Автополотенце, 50x60 см, 1 шт.;resnyn
ozon;344265664;Микрофибровое полотенце для сушки автомобиля LERATON YELLOW TWIST MF2 60x50 600 гр/м2;leraton
ozon;1783876601;DryMonster Автополотенце, 50х60 см, 1 шт.;drymonster
ozon;1783877407;DryMonster Автополотенце, 50х60 см, 1 шт.;drymonster
ozon;1123375681;MegaShiner Автополотенце, 50 x 60 см, 1 шт.;megashiner
ozon;1861967283;Супервпитывающее полотенце для сушки автомобиля DRY MONSTER размер 50*60 / цвет серый;drymonster
ozon;1684032326;Микрофибровое полотенце для сушки кузова Extra Dry 50*60;grass
ozon;1763535748;"Дворники для автомобиля 600/400 адаптер Push button 19mm; щетки стеклоочистителя Ситроен С4 2 3 B7 NC C41; Хавал Ф7; Опель Мокка с 06.2020; Форд Куга 1; Пежо 208 2. OEM 642381 642383";bezBrenda
ozon;659998677;600 400мм. PushButton 19мм. Щетки стеклоочистителя RD5 на HAVAL F7, H2, F7X, Хавейл Ф7 Хавал Ф7, Москвич 3, Хавейл Ф7Икс Хавал Ф7Икс;rd5
ozon;1865203389;2 Щетки стеклоочистителя 600 400 мм, Дворники для автомобиля GOODYEAR для Лада Гранта фл, Калина 1,2, Киа Рио 4, Спортейдж 2. На авто Хавал ф7, Москвич 3. Для Мазда 6 gh, Ниссан Х трейл т30 т31;goodyear
ozon;871748281;Дворники на хавал ф7, бескаркасные щетки на москвич 3, 600 400 мм кнопка Push Button 19mm;roadrunner
ozon;1347211732;"Щетки стеклоочистителя 600 400 ДЕТАЛИУС Крепление Push button 19mm дворники Ситроен С4 2 3 B7 NC C41, Хавал Ф7, Опель Мокка с 06.2020, Форд Куга 1; Пежо 208 2";detalyus
ozon;1763534856;"Щетки стеклоочистителя 650 350 адаптер hook; дворники автомобильные для Тойота Королла е18, е15; Аурис е18; Киа Сид 2 jd; Сузуки сх4; Хендай Санта Фе 3. OEM 3397007570";bezBrenda
ozon;582092615;"650 350 мм Комплект бескаркасных щеток стеклоочистителя RD5 дворники на Elantra Елантра; Santa Fe; Ceed Сид; Cerato Церато; Auris; Аурис; Corolla, Королла";rd5
ozon;1586391210;Щетки стеклоочистителя 650 350 для Toyota Corolla E150 E180 / Комплект дворников 2 шт для Тойота Королла Е150 Е180;kurumakit
ozon;2014089449;Щетки стеклоочистителя 650/350 бескаркасные (Hook крючок), Elantra Елантра, Santa Fe, Ceed Сид, Cerato Церато, Corolla, Королла БЕЛАК;belak
ozon;773797521;Щетки комплект Kia Ceed 2012-2018 (650 и 350 мм) / Дворники Киа Сид;avs
ozon;1347212064;"Щетки стеклоочистителя 650 350 ДЕТАЛИУС Крепление hook; дворники Тойота Королла е18, е15, Аурис е18, Киа Сид 2 jd, Сузуки сх4, Хендай Санта Фе 3";detalyus
ozon;1763520329;"Щетки стеклоочистителя 650 450 адаптер крюк; дворники 650/450 автомобильные для Хонда Цивик 9, 10; Аутлендер 3; Тойота Камри V50; Киа Оптима JF; Ситроен С5 1 до 11.2003. OEM 3397007706";bezBrenda
ozon;428865191;"650 450мм. Щетки стеклоочистителя RD5 дворники Toyota Camry V50; Тойота Камри; Mitsubishi Outlander; Мицубиси Аутлендер; Kia Optima";rd5
ozon;218471810;2 Щетки стеклоочистителя в комплекте 650 450 мм, Дворники для автомобиля GOODYEAR для Тойота Камри 50 (01-06,11-18), Митсубиси Аутлендер 3 (12-н.в), Омода c5, Ниссан Мурано Z52;goodyear
ozon;1081919718;650 450 мм.Тип крепления Крючок. Комплект бескаркасных щеток стеклоочистителя. Камри 50 , Mitsubishi Outlander GF 2012 - Мицубиси Аутлендер 2012 -, Kia Optima GF Киа Оптима;kirin.Auto
ozon;1787797322;"Дворники 650 450 безкаркасные комплект (крепление крючок HOOK) для Toyota Camry V50 / Тойота Камри; Mitsubishi Outlander / Мицубиси Аутлендер; Kia Optima Avantech MAX AWS005";avantech
ozon;1347212328;"Щетки стеклоочистителя 650 450 ДЕТАЛИУС Крепление крюк; дворники Хонда Цивик 9, 10; Аутлендер 3; Тойота Камри V50; Киа Оптима JF; Ситроен С5 1 до 11.2003";detalyus
ozon;1763533475;"Дворники для автомобиля 600 425 адаптер Aero clip; щетки стеклоочистителя Хавал Джолион c 2021 года; Бмв Серия 2 Купе. OEM 5205102XST01A 5205104XST01A";bezBrenda
ozon;1115550771;"600 425 мм. Крепление Aero Clip. Комплект бескаркасных щеток стеклоочистителя RD5 дворники Haval Jolion, Хавал Джолион; Chitu; Читу";rd5
ozon;1195646732;"600 425 мм. Крепление Aero Clip. Комплект бескаркасных щеток стеклоочистителя KEXITT дворники на Haval Chitu; Хавал Читу ; Haval Jolion; Хавал Джолион";kexitt
ozon;1425023386;Щетки стеклоочистителя всесезонные 600/425 Haval Jolion, Хавал Джулион, крепление AeroClip, комплект 2 шт;threeon
ozon;1347211767;Щетки стеклоочистителя 600 425 ДЕТАЛИУС Крепление Aero clip дворники Хавал Джолион c 2021 г;detalyus
ozon;1763534600;"Щетки стеклоочистителя 600/450 адаптер крючок; дворники для автомобиля LADA Лада Веста GFL, SW/SW Cross; Рено Дастер SUV 2015-2017; Меган 2; Киа Сид 4; Спортейдж 3; Лансер 9. OEM 13277083";bezBrenda
ozon;368113695;"600 450мм. Крепление Hook. Бескаркасные щетки стеклоочистителя RD5 дворники Lada Vesta Лада Веста; Chevrolet Cruze Шевроле Круз; Kia Sportage Киа Спортаж; Mazda 6 Мазда 6; Renault Duster Рено Дастер;";rd5
ozon;218476012;2 Щетки стеклоочистителя в комплекте 600 450 мм, Дворники для автомобиля GOODYEAR для Лада Веста, Хендай Санта фе 2, Мазда 6 gh, Киа Спортейдж 3, Омода S5, Чанган CS 35;goodyear
ozon;1793935525;"600 450мм. Крепление Hook. Бескаркасные щетки стеклоочистителя, дворники Lada Vesta Лада Веста; Chevrolet Cruze Шевроле Круз; Kia Sportage Киа Спортаж; Mazda 6 Мазда 6; Renault Duster Рено Дастер;";maiakavto
ozon;1064211219;Щетки стеклоочистителя для KIA Sportage 3 (2010 - 2016 г.в.) (600 и 450 мм) / Дворники для автомобиля киа спортейдж 3;hofer
ozon;1347211842;Щетки стеклоочистителя 600 450 ДЕТАЛИУС Крепление крючок, дворники Лада Веста GFL, SW/SW Cross, Рено Дастер SUV 2015-2017, Меган 2, Киа Сид 4, Спортейдж 3, Лансер 9;detalyus
ozon;1763533383;"Дворники для автомобиля 600 400 адаптер Push button 16mm; щетки стеклоочистителя Шкода Рапид. OEM 6R1955425A 6R1955426A 6R1998002";bezBrenda
ozon;654912787;"600 400 мм. Push Button 16 мм. Комплект бескаркасных щеток стеклоочистителя RD5 дворники Skoda Fabia; Шкода Фабиа; Rapid; Рапид; Volkswagen Polo Hatchback; Фольксваген Поло Хетчбек; AUDI A1; Ауди А1";rd5
ozon;1191152560;"600 400 мм. Push Button 16. Бескаркасные щетки стеклоочистителя KEXITT дворники Skoda Fabia 3; Шкода Фабиа 3; Rapid; Шкода Рапид; Volkswagen Polo Hatchback; Фольксваген Поло Хетчбек; AUDI A1; Ауди А1";kexitt
ozon;1197276369;Комплект щеток Skoda Rapid 2020-2024 (600 и 400 мм) / Дворники Шкода Рапид VALVEOM;valveom
ozon;1557633053;Бескаркасные щетки стеклоочистителя Zekkert (Германия) 600 400 мм, Крепление Narrow Push Button 16мм Дворники Skoda Rapid Volkswagen Polo Audi S1, Шкода Рапид Фольксваген Поло Ауди С1;zekkert
ozon;1347211574;Щетки стеклоочистителя 600 400 ДЕТАЛИУС Крепление Push button Дворники Шкода Рапид;detalyus
ozon;1763520027;"Щетки стеклоочистителя 650 500 адаптер крючок; дворники автомобильные для Тойота Ленд Крузер Прадо 150; Камри V70; Лэнд Ровер Дискавери Sport B5 L550. OEM 3397007706";bezBrenda
ozon;432165871;"650 500 мм. Крепление Hook. Комплект бескаркасных щеток стеклоочистителя RD5 дворники на Toyota Camry; Тойота Камри; Toyota Land Cruiser Prado; Тойота Ленд Крузер Прадо; Lexus GX 460; Лексус ГХ 460";rd5
ozon;1444590473;Дворники на Тойота Ленд Крузер Прадо 150 650 500 / щетки стеклоочистителя на Toyota Land Cruiser Prado 150 - крепление КРЮЧОК ( Hook );motla
ozon;1890133496;2 Щетки стеклоочистителя 650 500 мм, Дворники для автомобиля GOODYEAR для Тойота Ленд Крузер Прадо 150, Форд Фокус 4, Фольксваген Тигуан 2 (Олспейс, Туарег), БМВ x3 f25;goodyear
ozon;1808227344;ASIXE Комплект бескаркасных щеток стеклоочистителя, арт. KITXF650500, 65 см + 50 см;asixe
ozon;1347212390;Щетки стеклоочистителя 650 500 ДЕТАЛИУС Крепление крючок, дворники Тойота Ленд Крузер Прадо 150, Камри V70, Лэнд Ровер Дискавери Sport B5 L550;detalyus
ozon;1747174322;"600 450 Комплект гибридных щеток стеклоочистителя Деталиус адаптер Vatl5.1; Дворники 60 45 для автомобиля Лада Веста SW Cross, NG с 11.2019 года Рено Дастер с 03.2017 Ниссан Террано 3. OEM 288902888R";detalyus
ozon;1582563381;"600 450 мм. Крепление VATL 5.1 Комплект гибридных щеток стеклоочистителя RD5 на Lada Vesta Лада Веста; NG; НГ; Nissan Terrano 3; Ниссан Террано 3; Renault Arkana; Рено Аркана";rd5
ozon;1190791965;"600 450мм Крепление VATL 5.1 Щетки стеклоочистителя KEXITT дворники на Лада Веста, Nissan Ниссан Террано 3, Renault Рено Дастер Аркана;";kexitt
ozon;1399363695;600 450 мм. Щетки стеклоочистителя бескаркасные комплект Лада Веста, Рено Дастер, Vesta Duster Ниссан Террано/ Автомобильные дворники 60 45 см, Крепление VATL5.1 / Автодворники LYNXauto;lynxauto
ozon;1841941430;Дворники Лада Веста vatl 5.1 / Щетки стеклоочистителя Лада Веста / Дворники Рено Дастер / Щетки Аркана / Гибридные 600мм 450мм Zekkert;zekkert
ozon;632553007;"600 450мм Крепление VATL 5.1 Комплект бескаркасных модифицированных стеклоочистителя RD5 Lada Vesta Лада Веста; NG; НГ; Nissan Terrano 3; Ниссан Террано 3, Renault Arkana; Рено Аркана;";rd5
ozon;1315961790;"600 450 мм.Тип крепления (Ватл) VATL 5.1 Комплект бескаркасных щеток стеклоочистителя. Vesta Лада Веста, Nissan Terrano; Ниссан Террано, Renault Duster; Зимние; Летние";kirin.Auto
ozon;1747172474;650 350 Комплект гибридных щеток стеклоочистителя Xray, Kaptur/ Дворники 65 35 для автомобиля Лада Х Рей, Рено Каптур, Клио 4, адаптер Bayonet Arm/ Bosch Aerotwin A868S/ OEM 288909871R, 288900432R;detalyus
ozon;842510003;Комплект щеток стеклоочистителя Lada X-Ray, Lada X-Ray Cross - LYNXauto XF 650-360 мм, бескаркасные;lynxauto
ozon;429317724;"650 350мм Kрепление Bayonet arm. Комплект бескаркасных щеток стеклоочистителя RD5 дворники LADA XRAY ЛАДА Икс Рей; RenaultCaptur Рено Каптюр; Clio IV Клио 4";rd5
ozon;1580427553;"650 350мм Kрепление Bayonet arm. Комплект гибридных щеток стеклоочистителя RD5 дворники LADA XRAY; ЛАДА Икс Рей; Рено Каптюр; Рено Клио 4;";rd5
ozon;486946170;650 350 мм. Щетки стеклоочистителя бескаркасные Лада Иксрей, Рено Каптюр 1/LADA X-Ray Renault Kaptur Clio Клио Дворники автомобильные 65 35 см. Автодворники LYNXauto Bayonet Arm;lynxauto
ozon;1747177249;"600 425 Комплект гибридных щеток стеклоочистителя Деталиус адаптер Aero clip; Дворники для автомобиля Хавал Джолион c 2021 года; Бмв Серия 2 Купе. OEM 5205102XST01A 5205104XST01A";detalyus
ozon;1603192424;"600 425 мм. Крепление Aero Clip. Комплект гибридных щеток стеклоочистителя RD5 дворники на Haval Jolion, Хавал Джолион; Chitu; Читу";rd5
ozon;1747179060;"600 380 Комплект гибридных щеток стеклоочистителя Деталиус адаптер pinch tab; Дворники автомобильные 600мм 380мм Ниссан Кашкай j10 Nissan Qashqai. OEM 28890JD900 28890JD910";detalyus
ozon;1114649591;600 375 мм. Крепление Pinch Tab. Щетки стеклоочистителя бескаркасные RD5 дворники на Nissan Qashqai J10, Ниссан Кашкай;rd5
ozon;1602167661;"600 375 мм. Крепление Pinch Tab. Комплект гибридных щеток стеклоочистителя RD5 дворники на Nissan Qashqai J10; Ниссан Кашкай";rd5
ozon;1195624193;"600 375 мм. Крепление Pinch Tab. Комплект бескаркасных щеток стеклоочистителя KEXITT дворники на Nissan Qashqai 1 (J10) 12.06-01.14; Ниссан Кашкай 1";kexitt
ozon;1747170431;"650 425 Комплект гибридных щеток стеклоочистителя Деталиус адаптер Side pin; дворники 650мм 425мм для автомобиля Форд Фокус 2; Пежо 207. OEM 6426YW";detalyus
ozon;1602243682;"650 425 мм. Side Pin 22 мм. Комплект гибридных щеток стеклоочистителя RD5 дворники Ford Focus 2; Форд Фокус 2 ; Peugeot 207 CC; Пежо 207 СС ; 207 SW; Пежо 207 СВ";rd5
ozon;1114538592;"650 425 мм. Side Pin 22 мм. Комплект бескаркасных щеток стеклоочистителя RD5 дворники Ford Focus 2; Форд Фокус 2 ; Peugeot 207 Пежо 207 ; 207 ЦЦ 207 СС ; 207 SW 207 СВ";rd5
ozon;1825279916;LINKWAY Комплект бескаркасных щеток стеклоочистителя, арт. SHSZB55261701, 65 см + 42.5 см;linkway
ozon;2190848691;"Щетки стеклоочистителя бескаркасные 650/425, дворники для Ford Focus 2; Peugeot 207";tewson
ozon;1747174936;"600 450 Комплект гибридных щеток стеклоочистителя Деталиус адаптер Push button 19mm, Дворники для автомобиля Пежо 308 2; Киа Сид ED, CD; Джили Кулрей SX11; Шкода Суперб 2. OEM 983502L000";detalyus
ozon;1586098050;600 450 мм. Крепление Push Button 19. Комплект гибридных щеток стеклоочистителя RD5 на Kia Ceed, Сид, Peugeot 308, Skoda Superb B6, Суперб, Volkswagen Caddy;rd5
ozon;1429660813;THREEON Комплект бескаркасных щеток стеклоочистителя 600/450 Omoda S5, Geely Coolray, крепление push button 19 mm, всесезонные бескаркасные дворники, 2 шт;threeon
ozon;660196445;"600 450мм Крепление Push Button 19. Щетки стеклоочистителя RD5. Kia Ceed, Сид, Peugeot 308, Skoda Superb B6, Суперб, Volkswagen Caddy;";rd5
ozon;1359988883;"600 450мм.PushButton 19. Бескаркасные щетки стеклоочистителя RD5 на Geely Coolray Джили Кулрей; OMODA S5 Омода С5; Jetour Dashing Джетур Дашинг";rd5
ozon;1747178076;"600 400 Комплект гибридных щеток стеклоочистителя Деталиус адаптер Push button 16mm; Дворники автомобильные Шкода Рапид. OEM 6R1955425A 6R1955426A 6R1998002";detalyus
ozon;1582680825;"600 400мм. Крепление Pushbutton 16мм. Комплект гибридных щеток стеклоочистителя RD5 дворники Skoda Fabia; Шкода Фабиа; Rapid; Рапид; VolkswagenPolo Hatchback; Фольксваген Поло Хетчбек; AUDIA1; Ауди А1";rd5
ozon;1206049153;Дворники на Skoda Rapid l 2012-2018 Skoda Rapid ll 2020-2023, Щетки Шкода Рапид Щетки стеклоочистителя гибридные 600 400 мм;zekkert
ozon;1759811501;"Щетки стеклоочистителя 600/400 Push Button 16mm. Дворники Шкода Рапид; Фольксваген Поло Лифтбек";melee
ozon;1747178588;"600 400 Дворники для автомобиля Деталиус адаптер крюк; щетки стеклоочистителя LADA Лада Гранта; Хендай Солярис 2 YC; Киа Рио 4 YB SC FB; Фольксваген Поло Седан 612, 614; Лансер 10";detalyus
ozon;1579990942;"600 400 мм. Крепление Hook. Комплект гибридных щеток стеклоочистителя RD5 дворники на Skoda Rapid Шкода Рапид; Hyundai Solaris Солярис; Kia Rio Киа Рио; Volkswagen; Гранта; Toyota RAV4 Тойота РАВ4;";rd5
ozon;1471182734;600 400 мм Крючок Hook Комплект гибридных щеток стеклоочистителя ITIKO, дворники на Шевроле Каптива Hyundai Solaris Киа Спортейдж Киа Рио ВАЗ Гранта Mazda 6;itiko
ozon;1763811360;"Щетки стеклоочистителя 650 400 адаптер крюк; дворники для автомобиля Киа Рио 3; Хендай Солярис 1; Крета Акцент; Ниссан Кашкай j11; х трейл т32. OEM 3397118911";bezBrenda
ozon;1622917650;"600 400мм. Крепление Hook крючок. Гибридные щётки стеклоочистителя дворники на Лада Гранта, Kia Rio Киа Рио; Toyota RAV4 Тойота РАВ4; Hyundai Solaris Солярис; Skoda Rapid Шкода Рапид; Volkswagen";avtomoe
ozon;1747180584;"550 475 Комплект гибридных щеток стеклоочистителя Деталиус адаптер Bayonet Arm; Дворники для автомобиля Рено Логан 2 L8 c 04.2015; Сандеро 2 B8 с 2015 года; Дастер 2 SUV с 2017 года. OEM 288905401R";detalyus
ozon;1586455629;"550 475мм. Крепление bayonet arm. Комплект гибридных щеток стеклоочистителя RD5 дворники Renault Logan 2(Stepway); Логан; Renault Sandero 2; Рено Сандеро";rd5
ozon;661072078;"550 475мм. Крепление bayonet arm. Щетки стеклоочистителя RD5 дворники Renault Logan 2(Stepway); Логан; Renault Sandero 2; Рено Сандеро";rd5
ozon;1924804417;"550 475 мм.Крепление Bayoneta Arm (байонета арм). Комплект бескаркасных щеток стеклоочистителя. Renault Logan 2 MCV; Рено Логан 2 МСВ ; Sandero 2; Сандеро 2 ; Symbol 3; Симбол 3";kirin.Auto
ozon;1347210928;"Щетки стеклоочистителя 550 475 Деталиус адаптер bayonet arm; дворники для автомобиля Рено Логан 2 L8 c 04.2015; Сандеро 2 B8 с 2015 года; Дастер 2 SUV с 2017 года. OEM 288905401R 288905811R";detalyus
ozon;1747182367;"550 450 Комплект гибридных щеток стеклоочистителя Деталиус адаптер Hook Крючок; Дворники для автомобиля 55 45 Чери Тигго 7 про; Chery Tiggo 7 pro max. OEM 3397008937 3397008933";detalyus
ozon;1586008940;"550 450мм Комплект гибридных щеток стеклоочистителя RD5 на Chery Tiggo 7 Pro; Тигго 7; Mazda 6; Pajero Sport; Паджеро Спорт; Mitsubishi L200";rd5
