marketplace;marketplaceProductId;title;brand
ozon;1628467935;Фильтр салонный пылевой Hongqi HS5/H5, Mazda 3 bm, 6 gj/6 gl, cx-5 / Мазда 3, 6, Сх5, Хончи / Кросс номер MANN-FILTER CU24009, OEM KD4561J6X9A;mavyko
ozon;192421484;Фильтр салонный MAZDA МАЗДА 3 6 CX-5 CU24009 KD4561J6X KD4561J6X9A;marshall
ozon;1419609959;Фильтр салонный Mazda KD4561J6X9A MAZDA 3, 6, CX5;mazda
ozon;864835841;Masuma Фильтр салонный Пылевой арт. MC-2048, 1 шт.;masuma
ozon;1483149458;Салонный фильтр МАЗДА 6 gj, 3 бм, сх5 (1 и 2 поколение) ХОНЧИ h5 и hs5, Хунцы h5 и hs5 Фильтр салона Mazda 3 bm, cx-5, Hongqi H5 HS5 (н5 и hs5) ОЕМ: KD4561J6X KD4561J6X9A;optimalparts
ozon;1628467694;Фильтр салонный угольный Форд Фокус 3, Куга 2, С Макс Эскейп 2, Вольво V40 / Ford Focus 3, Kuga 2, C-Max Escape 2, Volvo V40 / Кросс номер FILTRON K1350A/ OEM 1709013;mavyko
ozon;894770420;Фильтр салонный угольный RD5 FORD Focus 3 Форд Фокус, Kuga 2 Куга, C-Max 2, Grand C-Max GT, Tourneo Connect, Grand Tourneo Connect, Transit Connect 2 Journey OEM 1709013;rd5
ozon;195101126;Фильтр салонный угольный FORD ФОРД C-Max Focus Фокус Kuga Куга VOLVO ВОЛЬВО V40 CUK25007 1709013 1776360 31369455 31404958 AV6N19G244AA;marshall
ozon;1411027931;Салонный фильтр угольный Форд Фокус 3 1.6, Куга 2, 1709013;lgnFilter
ozon;1628466188;Фильтр салонный пылевой Лада Веста Х Рей Рено Логан 2 Сандеро степвей 2 Каптюр Аркана Ниссан Жук / Lada Vesta Nissan Juke Mitsubishi Asx/ Кросс номер BIG FILTER GB9978/ OEM VAG 272773277R 272773016R;mavyko
ozon;1801380993;"Фильтр салонный Рено Логан 2/Сандеро2, Сандеро Стэпвэй 2, Каптюр, Аркана, Лада Веста/Веста NG, Лада XRAY ""FORTECH"" FS-146";fortech
ozon;275363599;Фильтр салонный LADA ЛАДА, ВАЗ Vesta Веста X-Ray NISSAN НИССАН Micra RENAULT РЕНО Duster Дастер Kaptur Каптур Logan Логан CU22011 272773016R 272775FA0A 278916PA0A 278916PA0B;marshall
ozon;1538721861;Фильтр салона противоаллергенный ЛАДА Веста, Х рей, РЕНО Логан 2, Сандеро, 272773016R, 272773277R;lgnFilter
ozon;245892008;BIG FILTER GB-9978 Фильтр салонный Лада Веста Рено Логан 2 , Сандеро 2 RENAULT Logan II/Sandero II 12-, LADA Vesta;bigFilter
ozon;1628465988;Фильтр салонный угольный Лада Веста Х Рей Рено Логан 2 Сандеро степвей 2 Каптюр Аркана Ниссан Жук / Lada Vesta Nissan Juke Mitsubishi Asx/ Кросс номер BIG FILTER GB9978/ OEM VAG 272773277R 272773016R;mavyko
ozon;885729886;Фильтр салонный угольный RD5 Vesta Веста, Vesta Cross, Vesta SW, Vesta SW Cross, X-RAY Икс Рэй, Arkana Captur J5 H5, Аркана Каптюр Clio 4 5 Duster 2 Logan 2 Sandero 2 3, Micra 5 Дастер Логан;rd5
ozon;275331096;Фильтр салонный угольный LADA ЛАДА, ВАЗ Vesta Веста X-Ray NISSAN НИССАН Micra RENAULT РЕНО Duster Дастер Kaptur Каптур Logan Логан CUK22011 272773016R 272775FA0A 278916PA0A 278916PA0B;marshall
ozon;245892005;BIG FILTER GB9978/C Фильтр салонный угольный Лада Веста Рено Логан 2 , Сандеро 2 RENAULT Logan II/Sandero II 12-, LADA Vesta;bigFilter
ozon;1315498048;Фильтр салона угольный ЛАДА Веста, Х рей, РЕНО Логан 2, Сандеро, 272773016R, 272773277R;lgnFilter
ozon;1628468346;Фильтр салонный угольный Лада Ларгус, Ниссан Альмера G15 Микра К12 Ноут Е11 Марч К12 Террано 3, Рено Дастер 1 Логан 1 Сандеро 1 Клио 3, Митсубиси Дион / Кросс номер Nordfil CN 1002K , OEM 8201153808;mavyko
ozon;1444395699;Салонный фильтр угольный Рено Логан 1, Дастер 2.0 1.6, Сандеро 1, 272772835R, Фильтр салона Лада Ларгус, Ниссан Альмера g15, 8201153808;lgnFilter
ozon;1093638149;Фильтр салона угольный SIBТЭК AC2505C OEM 27 27 721 32R, LADA Largus / NISSAN Almera, Micra III-IV, Note, Terrano III / RENAULT Clio III, Duster I, Logan, Sandero;sibtek
ozon;892450683;Салонный фильтр угольный Лада Ларгус, Рено Логан 1, Дастер 2.0 1.6, Сандеро 1, Ниссан Альмера g15;v12
ozon;1628468257;Фильтр салонный угольный Лада Веста, Х Рей, Митсубиси Л200, Аутлендер XL, Аутлендер 3, Паджеро Спорт 3, Пежо 4007 / Кросс номер SAKURA CAC-18120, OEM 7803A004 7803A005;mavyko
ozon;1147648487;Фильтр салонный угольный RD5 MITSUBISHI ASX, Митцубиши L 200, Lancer 8 Лансер 8, Outlander 2 3 Аутлендер , Pajero Sport 3 Паджеро, PEUGEOT Пежо 4007 4008, CITROEN Ситроен C4 Aircross OEM 8981394280;rd5
ozon;174425904;Салонный угольный фильтр MITSUBISHI Lancer VIII Outlander II-III ASX, NISSAN X-Trail I T30 Teana I J31 (МИТСУБИСИ Лансер 8 Аутлэндер АСХ, НИСССАН ИКС-Трейл/Тиана угольный фильтр SAKURA CAC18120;sakura
ozon;192417762;"Фильтр салонный угольный MITSUBISHI МИЦУБИСИ ASX L200 Lancer Лансер Outlander Аутлендер; PEUGEOT ПЕЖО 4008 CUK2141";marshall
ozon;1624364301;Салонный фильтр угольный МИТСУБИСИ Аутлендер 3 и xl хл, Паджеро спорт 3 МИЦУБИСИ Лансер 10 АСХ 1, л200 5 Джетур дашинг / MITSUBISHI Outlander Pajero Sport 3 ASX 1 L200 /Jetour x70, plus, x 90 плюс;stlFilter
ozon;1628467078;Фильтр салонный пылевой Шкода Октавия А5, Фольксваген Джетта 6, Тигуан 1 / Skoda Octavia A5, Yeti, Volkswagen Jetta 6, Passat b7, CC / Кросс номер MANN-FILTER CUK2939/ OEM VAG 1K1819653B 1K0819644B;mavyko
ozon;1511438473;Салонный фильтр Тигуан 1, ФОЛЬКСВАГЕН Пассат Б7 и Б6, Гольф 6 и 5, Джетта 4 ШКОДА Октавия А5, Суперб 2 Йети, АУДИ А3 8p Фильтр салона vw Фольцваген Tiguan Passat B7 B6 Golf Octavia A5 Yeti Audi A3 8P;optimalparts
ozon;185880894;Фильтр салонный AUDI АУДИ A3 Q3 SKODA ШКОДА Octavia Октавия VOLKSWAGEN ФОЛЬКСВАГЕН Golf Гольф Passat Пассат CU2939 1K0819644B 1K0819644 1K0819644A;marshall
ozon;1771413273;Салонный фильтр для Фольксваген Шкода Ауди 1K0 819 644A volskwagen skoda audi;royalHighness
ozon;1628466718;Фильтр угольный пылевой Шкода Октавия А5, Фольксваген Джетта 6, Тигуан 1 / Skoda Octavia A5, Yeti, Volkswagen Jetta 6, Passat b7, CC / Кросс номер MANN-FILTER CUK2939/ OEM VAG 1K1819653B 1K0819644B;mavyko
ozon;1805339735;Cartech Фильтр салонный Угольный арт. 1K1819653ACT, 1 шт.;cartech
ozon;185880934;"Фильтр салонный угольный AUDI АУДИ A3 Q3; SKODA ШКОДА Octavia Октавия; VOLKSWAGEN ФОЛЬКСВАГЕН Golf Гольф Passat Пассат";marshall
ozon;1317318736;Фильтр салонный угольный Шкода Октавиа 2 SKODA Octavia 2, Ауди Q3 AUDI 8U, Суперб, Superb 2, Yeti Йети, Volkswagen Jetta 3,4 Фольксваген Джетта, Tiguan 1 Тигуан Golf 5 6 Гольф OEM 1K1819653A;erikGuscher
ozon;1147433047;Фильтр салонный угольный RD5 SKODA Octavia 2 Шкода Октавиа, AUDI Ауди Q3 8U, Superb 2 Суперб, Yeti Йети, Volkswagen Jetta 3,4 Фольксваген Джетта, Tiguan 1 Тигуан Golf 5 6 Гольф OEM 1K1819653A;rd5
ozon;1628466517;Фильтр салонный угольный Шкода Октавия А7 Кодиак, Фольксваген Тигуан 2 Гольф 7 Пассат Б8/ Skoda Octavia A7 Kodiaq, Vw Passat b8 Tiguan 2/ Кросс номер MANN-FILTER CUK26009/ OEM VAG 5Q0819669 5Q0819653;mavyko
ozon;613048940;Салонный фильтр угольный ФОЛЬКСВАГЕН Тигуан 2 Пассат Б8 Гольф 7 8 Джетта 7 ШКОДА Октавия А8 А7 Кодиак Суперб 3 Карок АУДИ А3 8V, Фильтр салона VOLKSWAGEN Tiguan Passat SKODA Octavia Kodiaq Superb AUDI;rafFilter
ozon;1160724127;Фильтр салона угольный SIBТЭК AC0197C SKODA Kodiaq, Octavia 3-4, Superb 3, Volkswagen Caddy 5, Golf 7-8, Jetta 7, Passat B8, Tiguan 2 (OEM 5Q0819644);sibtek
ozon;1411048042;Салонный фильтр угольный ШКОДА Октавия А7, Карок, Кодиак, ФОЛЬКСВАГЕН Тигуан 2, 5Q0819653;lgnFilter
ozon;1628467857;Фильтр салонный угольный Ниссан Кашкай j10, Х-Трейл Т31, Дуалис / Nissan Qashqai j10, X-Trail T31, Dualis / Кросс номер MANN-FILTER CU1936, OEM 27277-EN000;mavyko
ozon;275327089;Фильтр салонный NISSAN НИССАН Qashqai Кашкай X-Trail Икстрейл CU1936 27277EN000 27277EN025 B7277EN00M;marshall
ozon;1859529878;Фильтр салонный угольный Ниссан Навара, Кашкай, Роуг, Сентра, Санни, X-Trail SSC1033, SS1033, PF2412;kortex
ozon;1012229830;Салонный фильтр угольный Ниссан Кашкай J11, Х-Трейл Т32, Икстрейл Т32, Рено Колеос, Меган, 272772621R;v12
ozon;719962536;"Фильтр салона угольный Nissan Qashqai I; Nissan X-Trail II KUJIWA KUK207 27277EN000";kujiwa
ozon;1628467740;Фильтр салонный угольный Шкода Фабия 2, Рапид, Фольксваген Поло 5, Поло седан / Skoda Fabia 2, Rapid, Volkswagen Polo, Vw Polo Sedan / Кросс номер MANN-FILTER CUK 26010, OEM VAG 6R0819653 6R0820367;mavyko
ozon;201026966;Фильтр салонный угольный AUDI АУДИ A1 SKODA ШКОДА Fabia Фабия Rapid Рапид VOLKSWAGEN ФОЛЬКСВАГЕН Polo Поло CUK26010 6R0819653 JZW819653F;marshall
ozon;885816763;Фильтр салонный угольный RD5 Polo 5 6R Поло, 6C Polo Sedan 61/Kaluga, SKODA Rapid NH3 Рапид, NH1 Fabia 2 5J6 Фабиа, 5J9 Fabia 3 NJ3, NJ5 Praktik Roomster AUDI A1 8X;rd5
ozon;618137426;Салонный фильтр угольный ФОЛЬКСВАГЕН Поло Седан 5 6 ШКОДА Рапид 1 2 Фабия 2 3 АУДИ А1, 6R0820367 JZW819653F Фильтр салона угольный Volkswagen Polo Sedan Skoda Rapid Fabia Audi;rafFilter
ozon;1628469509;Фильтр воздушный Лада Ларгус, Рено Логан 1, Дастер, Меган 2, Сандеро 2, Ниссан Альмера G15 Кросс номер Big filter GB 9719, OEM 8200431051;mavyko
ozon;1788899729;"Фильтр воздушный Рено Логан/Сандеро/Дастер 1.6, Меган 1.6, Лада Ларгус, Ниссан Альмера G15 - K4M ""FORTECH"" FA-101";fortech
ozon;185907839;Фильтр воздушный LADA Лада, ВАЗ Largus Ларгус Nissan Ниссан Almera Альмера III Renault Рено Duster Дастер I Logan Логан I II C18582 8200431051 1654600QAU 7701045724 165463164R 1654600Q3G;marshall
ozon;937095890;Фильтр воздушный Renault 8200431051 для Nissan Kubistar Primastar, Opel Vivaro, Renault Clio Duster Espace Kangoo Laguna Logan Enault Lutecia Megane Scnic Symbol;renault
ozon;1628469488;Фильтр воздушный Калина Гранта Приора Датсун Ваз 2109 2110 2112 2114 2115 с двигателем 21114 21116 21126 21127 / Кросс номер Mann filter C22117, OEM 21120110908082;mavyko
ozon;1266830073;Воздушный фильтр ВАЗ инжектор 2107 2112, 2114 , Нива, Калина, Приора, Гранта с металической сеткой;raider
ozon;727818702;"Фильтр воздушный ""FELIX 2110-12 В с сеткой"" для а/м ВАЗ ЛАДА инжектор";felix
ozon;249264722;LADA 21120110908082 Фильтр воздушный ВАЗ ЛАДА LADA инжектор Калина, Гранта, 2104-2107, Самара, 2110-2112, Нива, Датсун, Приора 21120110908082 С22117 GB9597;lada
ozon;884082099;Фильтр воздушный RD5 LADA Granta Гранта LADA Kalina Калина LADA Priora Приора, LADA 2104-2107, LADA Samara, LADA 2110-2112, Niva, Datsun ON DO, Datsun MI DO;rd5
ozon;1417264843;Фильтр воздушный MIGMA для LADA GRANTA/PRIORA/KALINA;migma
ozon;249265918;BIG FILTER GB9597C Фильтр воздушный ВАЗ ЛАДА LADA инжектор Калина, Гранта, 2104-2107, Самара, 2110-2112, Нива, Датсун, Приора 21120110908082 С22117 GB9597 (металлическая сетка);bigFilter
ozon;1628469397;Фильтр воздушный Тойота Авенсис т270, Аурис, Ярис, Версо, Аллион 260, Rav4 / Кросс номер AIKO A1013, OEM 178010d060;mavyko
ozon;742463593;Фильтр воздушный оригинальный 178010D060 для TOYOTA/LEXUS NX200 Auris Avensis Corolla Rav4 Verso Vitz Yaris;toyota
ozon;1860060592;Фильтр воздушный TOYOTA AURIS I II AVENSIS III COROLLA E150 COROLLA E180 RAV4 III IV, LEXUS NX200 FORTECH FA-043;fortech
ozon;185907854;Фильтр воздушный Toyota Тойота Avensis Авенсис Corolla Королла RAV 4 Yaris C24005 1780121050 178010D060 178010T030 178010M020;marshall
ozon;1628469333;Фильтр воздушный Хендай Акцент, Солярис 1, Солярис 2, Киа Рио 3, Соул 1, Соул 2, Hyundai Veloster / Кросс номер NEVSKY FILTER NF5456M, OEM 281131R100 28113-1R100;mavyko
ozon;877907608;Фильтр воздушный KIA Rio 3 2011 - 2017, Киа Рио, Solaris 2011 -2017, Солярис, HYUNDAI Veloster Велостер 11-17, KIA Soul 1 Соул (AM), KIA Soul 2 (PM);rd5
ozon;1309734050;"Фильтр воздушный Киа Рио 3, Солярис 1, Соул ""FORTECH"" FA-079";fortech
ozon;185907841;Фильтр воздушный HYUNDAI ХЕНДАЙ Accent Акцент Solaris Солярис Veloster KIA КИА Rio Рио Soul Соул C25016 281131R100;marshall
ozon;1557469781;Фильтр воздушный Киа / Хендай, 281131R100, Воздушный фильтр Рио 3 / Солярис, Hyundai Solaris 2010-2016 двигатель (1.4 и 1.6) , Kia Rio III 2011-2017 (1.4 и 1.6);hyundaiKia
ozon;1628469071;Фильтр воздушный Ситроен С Кроссер, Ситроен с4, Mitsubishi Asx, Outlander xl 2, Lancer 8, Пежо 4007, 4008 / Кросс номер LYNX LX2616, OEM 1500A023 1500A190;mavyko
ozon;185880868;Фильтр воздушный Mitsubishi Мицубиси ASX Lancer Лансер Outlander Аутлендер Peugeot Пежо 4007 C270031 1500A023 1444XE 1500A086 1444SJ 1444RT;marshall
ozon;843742705;Фильтр воздушный для Mitsubishi ASX, Lancer 10,Outlander XL, Citroen C-Crosser,Peugeot 4007.;justDrive
ozon;174438646;Воздушный фильтр MITSUBISHI LANCER VIII/ ASX / OUTLANDER II / CITROEN C-CROSSER/C4 AIRCROSS, PEUGEOT 4007/4008 (МИСУБИСИ Лансер 8 АСХ Аутлэндер 2 СИТРОЕН С-Кроссер С4 Эйркросс) SAKURA A5828;sakura
ozon;1628469021;Фильтр воздушный Ниссан Альмера классик б10, Примера р12 р11, Nissan Pathfinder R50, Teana j31 X-Trail T30, Isuzu, Субару Форестер sg, Suzuki SX4 / Кросс номер SAKURA A1818, OEM 165463J400 16546V0100;mavyko
ozon;174438943;Воздушный фильтр NISSAN TEANA I-II-III (J31-J32-J33)/X-Trail I (T30), SUZUKI Vitara (LY)/SX4 (НИССАН Тиана/ Х-Трейл, СУЗУКИ Витара/СХ4) SAKURA A1818;sakura
ozon;804907876;"Фильтр воздушный Альмера Н16; Альмера Классик; Примера Р12; Икстрейл Т30; Мурано Z50/Z51; Теана J31/J32, 165463J400; 16546V0100";doubleForce
ozon;192419169;"Фильтр воздушный NISSAN НИССАН Almera Альмера Classic, Primera X-Trail Икстрейл; SUBARU Forester Форестер Impreza C2964 16546V0100";marshall
ozon;1788898126;"Фильтр воздушный Ниссан Альмера Классик (аналог 1654695F0D), Примера, Субару Форестер, Импреза, Legacy ""FORTECH"" FA-038ST";fortech
ozon;1628468868;Фильтр воздушный Шкода Октавия А5, Фабия 2, Румстер Volkswagen Golf 6, Jetta 6, Polo 5, Vento Seat Leon Ibiza / Кросс номер Big filter GB8001, OEM VAG 036129620J 036129620H;mavyko
ozon;1145789233;Фильтр воздушный RD5 SKODA Fabia 1, 2 Шкода Фабиа, Octavia 2 Октавиа 2, Rapid NH3, NH1 2012-2015г., Рапид Caddy Кэдди Polo Поло Golf 5 6 Гольф Jetta 6 Джетта 6 OЕМ 036129620H, 036129620J;rd5
ozon;616226000;Фильтр воздушный Skoda Octavia II 06- Rapid 12- Volkswagen Golf 06- Polo Sedan 10- KUB0470 KUJIWA 036129620J;kujiwa
ozon;215991423;Фильтр воздушный 036129620J AMD.FA734 для VOLKSWAGEN Polo седан V 612, 602 1,6 -2015;amd
ozon;185880871;"Фильтр воздушный Skoda Шкода Fabia Фабия Octavia Октавия Rapid Рапид; Volkswagen Фольксваген Golf Гольф Jetta Джетта Polo Поло C3880";marshall
ozon;1628468784;Фильтр воздушный Лада Ларгус Веста Lada XRay Ниссан Террано 3, Рено логан 2, Сандеро Степвей 2, Каптур Доккер Дастер 2 Аркана / Кросс номер Mann filter C27030, OEM 165460509R 165467674R;mavyko
ozon;884063898;Фильтр воздушный RD5 Largus Ларгус до 08.2019, Vesta Веста до 08.2019, X RAY до 08.2019. Arkana Аркана , Kaptur Каптюр, Logan 2 Логан, Sandero 2 (Stepway), Duster 1 Дастер (все, кроме ДВС F4R с 2015);rd5
ozon;1738781159;"Фильтр воздушный Веста, Ларгус, Рено Дастер, Рено Логан 2, Сандеро Степвей, Каптюр ""FORTECH"" FA-239";fortech
ozon;275316777;Фильтр воздушный LADA ЛАДА, ВАЗ Largus Ларгус Vesta Веста X-Ray RENAULT РЕНО Duster Дастер Kaptur Каптур Logan Логан C27030 165460509R 1654600Q3H;marshall
ozon;249265923;BIG FILTER GB-962 Фильтр Воздушный Лада Веста, X-RAY Рено Дастер 2 / ВЫПУСК АВТО ДО 12.08.2019;bigFilter
ozon;1180631059;Фильтр воздушный Рено Дастер 2.0, Аркана, Логан, Сандеро, Каптюр, Лада Ларгус, Веста, Икс Рэй по 165460509R;erikGuscher
ozon;1628468627;Фильтр воздушный Мазда 3 BM, 6 gj-gl, сх5/ Mazda CX-5, 6 GJ-GL, 3 BM / Кросс номер Mann filter C27019, OEM PE07133A0A;mavyko
ozon;195101127;Фильтр воздушный Mazda Мазда 3 6 CX-5 C27019 PE07133A0A PEAR133A0;marshall
ozon;1713069770;UBS F2212001 Фильтр воздушный Mazda Мазда 3 6 CX-5 C27019 PE07133A0A PEAR133A0;ubs
ozon;917980416;Воздушный фильтр Мазда 3 (BM), Мазда 6 (BM) , Mazda CX-5 12-, PE07133A0A;v12
ozon;358966747;Воздушный фильтр MAZDA CX-5 (KE, GH, KF) / MAZDA 6 (GJ, GL) / MAZDA 3 (BM, BN) (МАЗДА СХ5/6/3) SAKURA A17200;sakura
ozon;1628468587;Фильтр воздушный Шевроле Круз Орландо, Опель Астра J Зафира с/ Chevrolet Cruze Orlando, Opel Astra J, Astra Gts Zafira C Tourer / Кросс номер Mann filter C26108, OEM OPEL 834622;mavyko
ozon;798958185;Фильтр воздушный Chevrolet Cruze 1.6/1.8, Orlando, Opel Astra J. FA-054;fortech
ozon;215758131;Фильтр воздушный CHEVROLET ШЕВРОЛЕ Cruze Круз OPEL ОПЕЛЬ Astra Астра C26108 834622 13272720;marshall
ozon;1180627135;Фильтр воздушный Шевроле Круз, Орландо, Опель Астра J, Зафира C, Зотти Купа по Filtron AP 051/8, Mann C26106 OEM 13272720;erikGuscher
ozon;215990063;Фильтр воздушный 13272717 AMD.FA52 для CHEVROLET Cruze J300, J305, J308 1,6/1,8 Orlando J309 1,8;amd
ozon;1628468536;Фильтр воздушный Хендай Крета 1, Creta 1.6, Creta 2.0 / Кросс номер Filtron AP1976, OEM 28113M4000 28113-M4000;mavyko
ozon;898141785;Фильтр воздушный RD5 Hyundai Creta Крета 1.6 MPI (G4FG) 01.2016 -, HYUNDAI Creta 2.0 (G4NA) 01.2016;rd5
ozon;2043442543;Фильтр воздушный HYUNDAI 28113M4000 для Хендай Крета Creta оригинал;hyundaiKia
ozon;2006054958;Фильтр воздушный Hyundai Хюндай Creta Крета FORTECH FA-246;fortech
ozon;215990508;Фильтр воздушный 28113M4000 AMD.FA788 для HYUNDAI Creta 1,6 2,0 2016-;amd
ozon;726213781;Фильтр воздушный 28113M4000 ASIN.FA2635 для HYUNDAI Creta 1,6 2,0 2016-;asin
ozon;1628469569;Фильтр воздушный Форд Фокус 2/3, Куга 1/2, С Макс, С Макс 2, Эскейп, Мазда 5, Вольво с30/S40 Кросс номер FILTRON AK 372-1, OEM 1848220 1708877;mavyko
ozon;1180629331;"Фильтр воздушный Форд Фокус 3 Ford Focus 2, Куга 1 Kuga 2, Grand, C-Max, Transit ,масляный фильтр Мазда MAZDA 3 BL 5 CW Вольва II S40 ; ОЕМ 1448616";erikGuscher
ozon;1014149792;Фильтр воздушный Ford Focus II, Mazda, Volvo, OEM 1848220 Форд Фокус II, Мазда, Волво;ford
ozon;905245818;Фильтр воздушный RD5 Ford Focus 2-3 Форд Фокус, Kuga 1-2 Куга, C-Max 1-2 Grand C-Max Tourneo Connect 2 Transit Connect 2 (CHC), MAZDA 3 BL 5 CW VOLVO C30 C70 II S40 II V40 II V50;rd5
ozon;185907840;Фильтр воздушный Ford Форд Focus Фокус Kuga Куга Mazda Мазда 3 5 Volvo Вольво S40 V40 C161341 1848220 1708877 1448616 1496204 31370984;marshall
ozon;1274856281;FILMANT Фильтр Воздушный C16134/2 для Ford Focus 2-3 Форд Фокус, Kuga 1-2 Куга, C-Max 1-2 Grand C-Max Tourneo Connect 2 Transit Connect 2 (CHC), MAZDA 3 BL 5 CW VOLVO C30 C70 II S40 II V40 II V50;filmant
ozon;1147264182;Фильтр масляный Ваз 2110, 2114, 2115, Ларгус, Гранта, Веста, Приора / кросс номер MANN w914/2 / OEM 21080101200582, 21080101200508;mavyko
ozon;1254752076;Фильтр масляный ВАЗ 2108 2115 2110 Priora Kalina 2190 Granta FL Vesta XRay largus LADA;raider
ozon;283138530;Фильтр масляный CHEVROLET ШЕВРОЛЕ Niva Нива LADA ЛАДА, ВАЗ Granta Гранта Priora Приора Kalina Калина Vesta Веста X-Ray W9142 21080101200508 21081012005 21051012005 21050101200500 152085PA0B;marshall
ozon;1861494322;Фильтр масляный Лада Гранта Веста Ваз 2109 2110 2114 Нива Калина Ларгус Приора X-рей;nac
ozon;1135193902;Фильтр масляный ВАЗ LADA Калина/Гранта/ Ларгус Приора/ Веста X-Ray Иксрей Chevrolet Niva 2107, 2108, 2109, 2110, 2112, 2113-2115;hofer
ozon;348123351;Масляный фильтр Лада Калина, Гранта, Ларгус , Приора, Веста, X-Ray DATSUN mi-DO / on-DO (Иксрей, Chevrolet Niva / Шеви Нива 1119, ДАТСУН) Sakura C25011;sakura
ozon;1164967955;Фильтр масляный Лада Ларгус, Рено Логан, Дастер К4М, К7М / кросс номер MANN w75/3 / OEM 7700274177, 8200768913, 8200768913, 7700873603;mavyko
ozon;1519813938;"Фильтр масляный Рено Логан 1, Логан 2, Дастер 2.0, Ларгус к4м, Ниссан Альмера G15 ""FORTECH"" FO-018";fortech
ozon;1076779798;Фильтр масляный Renault,Nissan,Mitsubishi,Opel,LADA (Largus) - OEM 7700274177 7711945897 8200768913 W753;renault
ozon;1850941342;Фильтр масляный Purflux LS932 Renault Duster 2.0, Kaptur, Logan, Nissan Terrano F4R 8200768913, 7700274177;purflux
ozon;215993398;Фильтр масляный 7700274177 AMD.FL723 для RENAULT Logan Sandero Sandero II LADA Largus;amd
ozon;1171244442;Фильтр масляный Нива 2121, Ваз 2107, 2106, Уаз Хантер, Буханка / кросс номер w920/21 MANN / OEM 15208BN30A, 21010101200582;mavyko
ozon;1508548179;Фильтр масляный ВАЗ 2101 2102 2105 2106 2107 2121 2123 3302 Газель;raider
