marketplace;marketplaceProductId;title;brand
ozon;967460023;Тормозные колодки передние Мазда сх5 - 4 шт, в комплекте со смазкой, арт.RND11203;r&D
ozon;809437011;Колодки тормозные передние Sangsin SP1671 Mazda CX-5;sangsinBrake
ozon;1720657436;"Колодки тормозные передние Mazda CX5 (Мазда СХ5); K0Y1-33-28Z; KDY9-33-28Z";doubleForce
ozon;1187714060;Колодки тормозные задние Hyundai Solaris, Kia Rio 3, 4, Ssangyong Korando 3/ OEM 583022KA00;mavyko
ozon;175377388;"Тормозные колодки дисковые ( задние) Hyundai Хендай i40 Solaris Солярис Tucson Туксан туксон; Kia Киа Rio Рио Soul Соул GDB3494 583021RA30";marshall
ozon;1101227445;Задние Тормозные Колодки Киа Рио 3 Солярис Хендай i30 i40 Туксон 3 Киа Сид 2 (JD) Оптима 3/4 Спортейдж 4 Церато 3 Kia Rio 3 Ceed Optima Sportage Cerato Hyundai Solaris Tucson OEM 4050004000 583021RA30;sangsinBrake
ozon;396363575;UBS B1103090 Тормозные колодки для HYUNDAI SOLARIS 10-/i30 11-/13-/i40 11-/KIA RIO 11-/12-/ GEELY ATLAS /CEED 12-/13-/OPTIMA 2.0 12-/SSANG ACTYON 10- задние;ubs
ozon;933859716;Задние Тормозные Колодки Киа Рио 3 Солярис Керамика Хендай i30 i40 Туксон 3 Киа Сид 2 Оптима 3/4 Спортейдж 4 Церато 3 Kia Rio 3 Ceed Optima Sportage Cerato Hyundai Solaris Tucson 4050004000 583021RA30;miles
ozon;1187682411;Колодки тормозные задние Ситроен, Форд Фокус, Куга, Транзит, Мазда 3, 5, Опель Вектра С;mavyko
ozon;175377244;Торм. колодки дисковые задние FORD ФОРД Focus Фокус II 04- CITROEN СИТРОЕН C5 II 08- MAZDA МАЗДА 3 I (BK) II (BL) 03- GDB1621 1360254 1809259 1753860 425405 1360306;marshall
ozon;952929679;Тормозные колодки задние Форд Фокус 2, Форд Фокус 3 Citroen C5 II 08- / Tourneo 02-, Мазда 3 I, II 03-, Opel Vectra C 02-, Volvo S40 II 04- Ford Focus;miles
ozon;396363130;UBS B1101002 Тормозные колодки для FORD FOCUS 04-KUGA VOLVO V50 S40-V40 13-MAZDA 3 04-CITR C5 08-PEU.508 10- задние компл. 4 шт.;ubs
ozon;1606483391;Тормозные колодки задние Форд Фокус 2, Фокус 3, (Ford Focus) Мазда 3 БК (Mazda 3 BK) по Sangsin SP2091;erikGuscher
ozon;1204599382;"Тормозные колодки передние HYUNDAI ХЕНДАЙ Solaris Солярис 1; KIA КИА Rio Рио 3 GDB3548 581014LA00";mavyko
ozon;175377385;"Тормозные колодки дисковые ( передние) HYUNDAI ХЕНДАЙ Solaris Солярис 1; KIA КИА Rio Рио 3 GDB3548 581014LA00";marshall
ozon;1386728916;Тормозные колодки передние SANGSIN (HI-Q) для Kia Rio 3, 4 / Hyundai Solaris 1, 2 (от 2011 г.в.) SP1399;sangsinBrake
ozon;1065458631;"Тормозные колодки дисковые передние Hyundai Solaris (Хендай солярис 1); Kia Rio (Киа рио 3, 4); Hyundai Accent (Акцент 4) / TRW GDB3548 / Комплект 4шт.";detal
ozon;405444491;UBS B1103013 Тормозные колодки HYUNDAI SOLARIS 10-/12-/KIA RIO III 11-/12- передние компл. 4 шт../;ubs
ozon;1187836809;Колодки Hyundai Solaris, Kia Rio 3, Geely Atlas / кросс номер Sangsin SP1399 / OEM 581011WA05 , 58101H5A25;mavyko
ozon;501550696;"Тормозные колодки дисковые ( передние) HYUNDAI ХЕНДАЙ Solaris Солярис; KIA КИА Rio Рио GDB3630 58101H5A25";marshall
ozon;985353712;Колодки Тормозные Хендай Солярис Передние Керамические Киа Рио 3 Hyundai Solaris Kia Rio 3 E500036 OEM 58101H5A25 581014LA00;miles
ozon;1606482898;Колодки тормозные Хендай Солярис передние, тормозные колодки Киа Рио 3 передние ОЕМ 581011RA00 TRW GDB3548;erikGuscher
ozon;1187765437;Колодки тормозные задние Skoda/Volkswagen/OEM 3Q0698451;mavyko
ozon;966401392;Тормозные колодки задние Шкода Кодиак, Суперб, Фольсваген Гольф, Пассат, Тигуан, Ауди A 3, Q 2 и 3 - 4 шт. в комплекте со смазкой, арт.RND11179;r&D
ozon;1300557177;Колодки тормозные задние GDB1957;trw
ozon;589721834;"Торм. колодки дисковые задние SKODA ШКОДА Kodiaq Кодиак; VOLKSWAGEN ФОЛЬКСВАГЕН Golf Гольф VII Passat Пассат (B8) Tiguan Тигуан II GDB1957 3Q0698451J";marshall
ozon;1187166940;Колодки тормозные задние Лада Веста 1.6 / 1.8, Х Рей 1.6 / OEM 11196-3502089-00;mavyko
ozon;396363730;UBS B1105004 Тормозные колодки Lada Vesta SW Cross / Kalina Sport / Granta Sport, задние, в комплекте со смазкой (5г) компл. 4 шт.;ubs
ozon;273160690;Колодки тормозные дисковые для автомобилей Лада Vesta/SW/SW Cross/Лада 1119 Kalina Sport задние TRIALLI PF 0171;trialli
ozon;2522770284;DINOZAVR, Тормозные колодки дисковые керамические ( задние ) LADA VESTA Лада Веста 1.6 / 1.8 и Х Рей Xray 1.6, OEM 11196-3502089-00;dinozavr
ozon;1076581813;Тормозные колодки задние LADA Vesta (SW / Cross / SW Cross) LADA XRAY / FIAT Punto / Panda / ОЕМ 21905350208087 GDB 1384 / Комплект 4шт.;det.All
ozon;1187886525;Колодки тормозные передние Ауди А3, Шкода Октавия/OEM 1K0615106AL;mavyko
ozon;175377402;"Торм. колодки дисковые передние Skoda Шкода Octavia Октавия II (A5) Rapid Рапид I II; Volkswagen Фольксваген Polo Поло Sedan I II GDB1550 5K0698151";marshall
ozon;985454342;Тормозные колодки Поло седан Передние , Фольксваген Гольф 5, 6 Шкода Октавия А5, Шкода Фабия 2,3 OEM 1K0698151;miles
ozon;396363278;UBS B1102037 Тормозные колодки SKODA RAPID 13-FABIA 10-VW POLO Седан 10-JETTA IV 12-GOLF V VI PASSAT 10-13-AUDI A3 пер. компл. 4 шт.;ubs
ozon;1187859326;Колодки тормозные передние для Тойота Камри, Lexus ES и Daihatsu / OEM 0446533450;mavyko
ozon;396366679;UBS B1110005 Тормозные колодки TOYOTA CAMRY V40 06-/V50 2.5/3.5 11-/LEXUS ES 250/350 06-/12- передние компл. 4 шт..;ubs
ozon;1639496299;"Колодки тормозные передние (Керамика) Toyota Camry V40/V50; Керамические тормозные колодки для Тойота Камри 04465-33440";miles
ozon;175377279;Тормозные колодки дисковые ( передние) Lexus Лексус ES Toyota Тойота Camry Камри GDB3429 04465YZZEG;marshall
ozon;951811635;Cartech Колодки тормозные дисковые Передние, арт. 0446533471CT;cartech
ozon;1187813286;Колодки тормозные задние Лексус, Тойота /OEM 446633200;mavyko
ozon;2086651603;"Тормозные колодки дисковые PLUS (задняя) Lexus: ES; Toyota: Camry, RAV 4 GDB3426 -";marshall
ozon;175409460;Задние тормозные колодки дисковые TOYOTA CAMRY (V4,V5)/RAV 4 III-IV/AVALON, LEXUS ES (V4/V6 (ТОЙОТА КАМРИ/РАФ4/АВАЛОН ЛЕКСУС ЕС) NiBK PN1522;nibk
ozon;552451552;HSB HP5178 Колодки тормозные задние Тойота Камри V40, V50, Рав 4, Toyota Camry RAV 4 Lexus ES V, VI;hsb
ozon;1187805294;Колодки тормозные передние Шевроле, Опель, Chevrolet / OEM 13412810;mavyko
ozon;288697158;Тормозные колодки дисковые ( передние) CHEVROLET ШЕВРОЛЕ Cruze Круз OPEL ОПЕЛЬ Astra Астра GDB1847 13412810 542115 13301234 95516193 1605178 9005020;marshall
ozon;663202128;Колодки тормозные передние SP1362 Шевроле Круз Шевроле Авео Опель Астра Ниссан Зафира Chevrolet Cruze Opel Astra Nissan;sangsinBrake
ozon;553231964;HSB HP2021 Тормозные колодки передние Шевроле Круз, Авео Т300, Опель Астра J / Chevrolet Cruze, Opel Astra.;hsb
ozon;962832785;Тормозные колодки передние ШЕВРОЛЕ Круз, Орландо, ОПЕЛЬ Астра 4, Мокка, Зафира 3 - 4 шт., в комплекте со смазкой, арт. RND11013;r&D
ozon;1187795756;Колодки тормозные передние Шкода, Ауди, Фольксваген / OEM 5Q0698151F;mavyko
ozon;175377325;Торм. колодки дисковые передние SKODA ШКОДА Octavia Октавия III (A7) IV (A8) VOLKSWAGEN ФОЛЬКСВАГЕН Passat Пассат (B8) Tiguan Тигуан II GDB1956 8V0698151 5Q0698151F;marshall
ozon;1074928411;"Тормозные колодки передние для Skoda Octavia 3 (A7) / Kodiaq / Karoq; Volkswagen Golf 7/ Passat (B8) / Caddy 4 / Tiguan 2; Audi Q3 / A3";det.All
ozon;1596585199;Тормозные колодки передние Тигуан 2, колодки Шкода Октавия А7, Шкода СуперБ, Кодиак, Фольксваген Гольф 7, Ауди А3, Q2 ОЕМ 8V0698151, 5Q0698151AH;erikGuscher
ozon;1187808912;Колодки тормозные передние для Форд Фокус, Мазда 3 и Вольво / OEM 1223682;mavyko
ozon;175377392;Тормозные колодки дисковые ( передние) FORD ФОРД Focus Фокус MAZDA МАЗДА 3 VOLVO ВОЛЬВО C30 C70 S40 GDB1583 1321517 1712024 1809256 BPYK3323ZA 1753844;marshall
ozon;396363134;UBS B1101001 Тормозные колодки FORD FOCUS II 04-III 11-KUGA I 08-II 13-ECOSPORT 14-MAZDA 3 03- VOLVO S40 04-передние компл. 4 шт.;ubs
ozon;984312186;Тормозные колодки Форд Фокус 2 Передние, Форд Фокус 3, Мазда 3 OEM 1321517;miles
ozon;1187774372;Колодки Haval f7 и H6, Honda CRV III,IV,V, Черри Тигго 8 Про / OEM 3501110XKY00A;mavyko
ozon;1424460612;Колодки тормозные передние HAVAL F7, H5, H6. F7x M6 Exeed VX TXL.Сhеry Tiggo 8 Prо Мax Changan CS75;sangsinBrake
ozon;1072791913;Передние тормозные колодки Chery Tiggo 8 Pro Max M31T6GN3501080 / Чери Тигго 8 Про Макс/ Полный привод;uidnu
ozon;1645067142;Колодки тормозные передние Хавал Ф7 (Haval F7/F7x), H6, Чанган ЦС75 (Changan CS75), Exeed TXL VX, Honda CR-V 5 / OEM M31T6GN3501080, S3010661000;arDistribution
ozon;1187718007;Колодки тормозные задние Шевроле, Опель/ OEM 13300867;mavyko
ozon;175377382;"Тормозные колодки дисковые ( задние) CHEVROLET ШЕВРОЛЕ Cruze Круз; OPEL ОПЕЛЬ Astra Астра Mokka мокка GDB1844 13411380";marshall
ozon;1416867125;Тормозные колодки Шевроле Круз Задние Sangsin HI-Q SP1363 Шевроле Орландо Опель Астра J 09-/12-/ Мокка 12-/13- компл. 4 шт.;sangsinBrake
ozon;933855849;Тормозные Колодки Шевроле Круз Орландо Опель Астра J, Мокка Chevrolet Cruze, Orlando Opel Astra J, Mokka OEM 13319294 13300867;miles
ozon;1187672022;Колодки тормозные задние Citroen, Ford, Transit, Mazda, Opel/OEM 1233679;mavyko
ozon;1407862110;Тормозные колодки задние Форд Фокус 2,3 Sangsin HI-Q SP2091 Форд Фокус 3 Citroen C5 II 08- / Tourneo 02-, Мазда 3 I, II 03-, Opel Vectra C 02-, Volvo S40 II 04- Ford Focus;sangsinBrake
ozon;1187711955;Колодки тормозные задние/ Колодки Mazda CX-5, CX-3/ OEM K0Y12648Z;mavyko
ozon;175409323;Задние тормозные колодки дисковые MAZDA CX-5 (KE, GH)/CX-3 (DK) (МАЗДА СХ-5, СХ-3) NiBK PN25001;nibk
ozon;1596584790;Тормозные колодки Мазда СХ5 задние, тормозные колодки Mazda CX-5 по Sangsin SP1860;erikGuscher
ozon;962822445;Тормозные колодки задние МАЗДА сх5, МАЗДА сх3 - 4 шт, в комплекте со смазкой, арт. RND11012;r&D
ozon;1187642944;Колодки тормозные задние Audi, Skoda Octavia, Fabia, Volkswagen Polo 3, Golf 3, Passat / кросс номер TRW GDB1330 / OEM 1E0698451;mavyko
ozon;175377398;Торм. колодки дисковые задние Skoda Шкода Octavia Октавия I-III 97- Rapid Рапид I II 12- Volkswagen Фольксваген Polo Поло Sedan I II 10- GDB1330;marshall
ozon;1015334610;Тормозные колодки Шкода Октавия А7 А5 А4 Задние Skoda Octavia Шкода Фабия Рапид Йети 5Q0698451A;miles
ozon;396363842;UBS B1107002 Тормозные колодки для SKODA RAPID FABIA VW GOLF IV V VI CITR C4 I II 04-PEU.308 09-PEU.2008 задние, в комплекте со смазкой (5г) компл. 4 шт.;ubs
ozon;1409779160;Тормозные колодки Шкода Октавия А7 А5 А4 Sangsin HI-Q SP1391 Задние Skoda Octavia Шкода Фабия Рапид Йети 5Q0698451A;sangsinBrake
ozon;1187612266;Колодки тормозные передние Джили Кулрей/Geely Coolray/OEM 4048046400;mavyko
ozon;1408441201;Колодки тормозные передние Monaer Geely Coolray дорест /Джили Кулрэй/4048046400;monaer
ozon;1598545328;Передние тормозные колодки для GEELY COOLRAY (SX11) 18-, CAREADY арт. C501012070;caready
ozon;1545147649;Передние тормозные колодки Geely Coolray / Джили Кулрей / рестайлинг;uidnu
ozon;1465014782;Тормозные колодки передние Джили Кулрей / GEELY COOLRAY - 4 шт., в комплекте со смазкой, арт. RND11518;r&D
ozon;1187194170;Колодки тормозные передние Лада Ларгус с двигателем K7M (Рено 8V), Лифан, Рено/Largus (K7M), Lifan, Renault/ OEM 410602192R;mavyko
ozon;175377249;Тормозные колодки дисковые ( передние) RENAULT РЕНО Clio Logan Логан Sandero Сандеро Stepway GDB1634 410602192R;marshall
ozon;552451903;HSB HP5197 Колодки тормозные дисковые передние Рено Логан, Рено Сандеро / Renault Logan Sandero 1 поколение, Лада Ларгус K7M;hsb
ozon;912693908;Колодка тормозная передняя (к-т 4 шт.) Riginal для а/м Renault Logan, Sandero 2004, LADA Largus;riginal
ozon;1015449019;Тормозные колодки Рено Логан 1 Передние Меган 1 Сандеро 1 Лада Ларгус OEM 410602192R;miles
ozon;1187872722;Тормозные колодки передние Лада Веста NG, МАВИКО / OEM 8460013695;mavyko
ozon;1967179828;Колодки тормозные (передние) Senfineco PB1187 OEM: 41060-AX085, LADA Vesta NG (Cross, SW) / NISSAN Note 1, Cube 2, Tiida 1, Livina 1-2;senfineco
ozon;1630381886;Колодки ПЕРЕДНИЕ Vesta NG , NISSAN TIIDA 2007-12 MARCH 2002-07 NOTE (Япония) 01-07 / Bluebird / Cube 2002-08 GDB3577 MILES E400544 Веста Нг;miles
ozon;2202888933;UBS B1105027 Тормозные колодки Lada Vesta NG Лада Веста НГ перед. в комплекте со смазкой (5г);ubs
ozon;1204657189;Колодки тормозные передние Лада Ларгус, Веста, Х Рей Кросс, Рено Дастер (K4M), Nissan Note, Micra/OEM 410608481R;mavyko
ozon;175377391;Тормозные колодки дисковые (передние) LADA ЛАДА, ВАЗ Largus Ларгус Vesta Веста RENAULT РЕНО Duster Дастер Logan Логан GDB3332 410608481R 4106000Q0K;marshall
ozon;396363775;UBS B1105007 Тормозные колодки LADA VESTA LARGUS NISSAN ALMERA IV 12- TERRANO III 14-(-ESP) RNLT DUSTER SUZUKI SWIFT III 05- SPLASH 08- 11- перед. компл. 4 шт.;ubs
ozon;217056073;Тормозные колодки передние BARNETT LD001 Лада Веста, Рено Логан, Лада Ларгус;barnett
ozon;920075766;Колодки тормозные передние;justDrive
ozon;1187848514;Колодки тормозные передние Ваз 2108-2115 / OEM 2110-3501080;mavyko
ozon;809443427;Колодки Передние Lada Priora, Granta, Kalina, ВАЗ 2110-2112 (Смесь CERAMIC) тормозные E500049 Ваз 2110 2111 2112 2113 2114 Калина Гранта Приора Лада;miles
ozon;1851216174;Колодки тормозные передние LADA Opигинaл, ВАЗ 2108 2109 2110 2112 2114 2115,Приора , Гранта Калина, Datsun;lada
ozon;396363737;UBS B1105001 Тормозные колодки для Лада Гранта, Приора, Калина, ВАЗ и Lada 2110, 2170, 1118, 2190 LADA SAMARA110-11 KALINA PRIORA GRANTA DATSUN on-Do mi-Do перед. компл. 4 шт.;ubs
ozon;1187840540;Колодки тормозные передние Ситроен, Додж, Мицубиси, Пежо / OEM MR527674;mavyko
ozon;952803904;Тормозные Колодки Лансер 9, 10 Передние Аутлендер 3 АСХ Mitsubishi Lancer Outlander ASX OEM MR527674 4605A795;miles
ozon;1407739747;Тормозные Колодки Передние Лансер 9, Митсубиси Лансер 10, АСХ Sangsin HI-Q SP1360 Mitsubishi ASX, Galant 9, Outlander 1-3 (TRW GDB4142) OEM 4605A795 4605A486;sangsinBrake
ozon;955226718;Тормозные колодки передние Akebono AN-650WK (Акебоно) для Mitsubishi Outlander 3 (Митсубиши / Митсубиси Аутлендер), ASX, Lancer 9, 10, X (Лансер), Dodge Caliber (Додж Калибер);akebono
ozon;175377399;Тормозные колодки дисковые Mitsubishi Митсубиси ASX CHARIOT DELICA DION ECLIPSE Galant Галант GRANDIS, Lancer Лансер Outlander Аутлендер SPACE RUNNER 4605A795 передние;marshall
ozon;1204636924;Колодки тормозные передние Фольксваген, Шкода/ Volkswagen Polo, Skoda Rapid (1ZE) /OEM 6RU698151A;mavyko
ozon;175377383;"Тормозные колодки дисковые ( передние) SKODA ШКОДА Fabia Фабия; VOLKSWAGEN ФОЛЬКСВАГЕН Polo Поло Sedan GDB2027 6RU698151A";marshall
ozon;1009669435;Колодки тормозные Фольксваген Поло седан RUS Шкода Рапид Фабия Rapid Fabia Polo Sedan Керамические Передние 6RU698151;miles
ozon;396362953;UBS B1102003 Тормозные колодки VW POLO Седан 10-, SKODA FABIA 11- передние компл. 4 шт../;ubs
ozon;2091443516;Тормозные колодки передние Hi-Q SP1595 для VAG VW POLO, Golf IV, Skoda Rapid, Octavia, Fabia (от 2011 г.в.) OEM: 6RF615109D / 6RU698151A / 6RU698151B;sangsinBrake
ozon;1187787188;Колодки тормозные передние PRO для Лада Ларгус, Веста, Х рей, Ниссан, Рено Логан, Дастер, Каптюр;mavyko
ozon;1728645154;Диск тормозной (левый/правый передний) для Lexus Лексус ES ЕС 200 250 300h 350, Toyota Тойота Auris Аурис Е150 Е180, RAV 4, Camry Камри 40-50, Harrier Prius / OEM 4351242050 A6F164B ND1048K BN1169;mavyko
ozon;175377337;Диск тормозной (левый/правый передний) Lexus Лексус ES Toyota Тойота Auris Camry Камри RAV4 Рав4 DF4828S;marshall
ozon;951433336;Cartech Диск тормозной, арт. 4351230310CT;cartech
ozon;1545659195;Диск тормозной передний Toyota Rav 4(A30), Rav 4(A40), Camry (V40), Camry (V50),Geely Emgrand X7.;justDrive
ozon;1283210407;Диски тормозные серии PRO (левый+правый передние) комплект для Volkswagen Фольксваген Polo sedan Поло седан Golf iv Гольф 4 Skoda Шкода Octavia A4 Октавия А4 Rapid Рапид Fabia Фабия / OEM 6R0615301C;mavyko
ozon;985513113;Тормозные Диски Поло Седан Передние Комплект 2 шт. Шкода Рапид Фабия Октавия Тур Фольксваген Гольф 4 5 Volkswagen Polo Sedan Skoda Rapid Fabia Octavia Tour (D 256 мм.) K000412 OEM JZW615301N 6R0615301;miles
ozon;1605885792;Комплект передних тормозных дисков для VOLKSWAGEN POLO SEDAN V / ФОЛЬКСВАГЕН ПОЛО СЕДАН 5 / седан / 2010 2011 2012 2013 2014 2015 2016 2017 2018 2019 г;lynxauto
ozon;1596613785;Тормозные Диски Поло Седан Передние Комплект 2 шт. Шкода Рапид Октавия Тур Фольксваген Volkswagen Polo Sedan Skoda Rapid Octavia Tour (D 256 мм );erikGuscher
ozon;1283197434;Диск тормозной (левый/правый передний) для Logan Логан, Lada Лада Largus Ларгус Vesta Веста, Nissan Ниссан Almera G15 Альмера Микра Note Ноут Tiida Клио 3/ OEM 8450031577 7701207795 M2000405 RN1187;mavyko
ozon;175377167;"Диск тормозной (левый/правый передний) LADA ЛАДА, ВАЗ Largus Ларгус; NISSAN НИССАН Micra Note ноут; RENAULT РЕНО Clio Megane Меган DF4364 7701207795";marshall
ozon;292156482;Диск тормозной для автомобилей Лада Vesta (15 ) передний d 260 TRIALLI DF 095106 1 шт;trialli
ozon;1247457277;BAPCO Диск тормозной, арт. BD0040;bapco
ozon;571870856;LYNXauto BN1062 Диск тормозной передний Лада Веста, Ларгус, ИксРей Lada Vesta, Largus, XRay;lynxauto
ozon;1283195939;Диск тормозной (левый/правый задний) для Hyundai Хендай Solaris Солярис i20 Киа Kia Рио Rio / OEM 58411-0u300 584110u300 SD1087;mavyko
ozon;175377168;Диск тормозной (левый/правый задний) Hyundai Хендай i20 Solaris Солярис Kia Киа Picanto пиканто Rio Рио DF7928 584110U300;marshall
ozon;1445088439;Диск тормозной задний HYUNDAI SOLARIS 10-/KIA RIO III 11- SD1087 - 1 шт.;sangsinBrake
ozon;1097162459;Тормозной Диск Кио Рио 3 Задний Хендай Солярис Sangsin Kia Rio 3 Hyundai Solaris HI-Q SD1087 OEM 584110U300;sangsinBrake
ozon;200961642;Диск заднего тормоза 58411-0U300 AMD.BD261 для HYUNDAI Solaris RB 2010- Solaris II 2017- KIA Rio UB 2011- Rio IV 2017-;amd
ozon;1283191935;Диск тормозной (левый/правый передний) для Hyundai Хендай Solaris i20 Солярис Киа Kia Рио Rio / OEM 51712C8000, 517120U000, SD1110;mavyko
ozon;175377177;"Диск тормозной (левый/правый передний) HYUNDAI ХЕНДАЙ Solaris Солярис; KIA КИА Rio Рио DF6198 517120U000";marshall
ozon;1097138990;Тормозной Диск Киа Рио 3 Передний Хендай Солярис Kia Rio 3 Hyundai Solaris Sangsin Hi-Q SD1110 OEM 51712C8000 517120U000;sangsinBrake
ozon;175676062;Диск тормозной (левый/правый передний) HYUNDAI ХЕНДАЙ Solaris Солярис KIA КИА Rio Рио DF6794 51712C8000;marshall
ozon;1391172303;Тормозной Диск Киа Рио 3 Передний Хендай Солярис Kia Rio 3 Hyundai Solaris Sufix FX-1141 OEM 51712C8000 517120U000;sufix
ozon;1283193311;Диск тормозной (левый/правый передний) для Volkswagen Фольксваген Polo sedan Поло седан Golf iv Гольф 4 Skoda Шкода Octavia A4 tour Октавия А4 тур Rapid Рапид Fabia Фабия / OEM 6R0615301C;mavyko
ozon;175377166;"Тормозной диск передний Skoda Шкода Fabia Фабия I-III Octavia Октавия I (A4) Rapid Рапид; Volkswagen Фольксваген Polo Поло Sedan DF2803";marshall
ozon;1394363612;Тормозной диск Поло Седан Передний Шкода Рапид Фабия Октавия Тур Фольксваген Гольф 4 5 Volkswagen Polo Sedan Skoda Rapid Fabia Octavia Tour (D 256 мм.) FX-1105 OEM JZW615301N 6R0615301;sufix
ozon;1769339701;"Тормозной диск передний Skoda Шкода Fabia Фабия I-III Octavia Октавия I (A4) Rapid Рапид; Volkswagen Фольксваген Polo Поло Sedan DF2803";kortex
