marketplace;marketplaceProductId;title;brand
ozon;1070092069;Свечи зажигания NGK LZKR6B-10E 1578 для KIA и Hyundai / КИА и Хендай (комплект 4шт.);ngk
ozon;898189972;Свечи зажигания NGK LZKR6B10E 1578 для HYUNDAI Creta GS Elantra (2009-) i20 (2009-) i30 (2009-) Solaris / KIA Carens (2006-) Ceed (2009-) Cerato (2009-) Rio (2011-) Soul (2009-) Venga 1.4л. и 1.6л. G4FG G4FC G4FA G4FD ХЕНДАЙ Солярис Крета КИА Рио Сид;ngk
ozon;2487468087;Bosch Свеча зажигания 0 242 129 515 Комплект 4 шт.;bosch
ozon;1350013423;Иридиевые свечи зажигания TORCH K6RIU-11 для Lada ВАЗ Toyota KIA Nissan ВАЗ 16кл 8кл киа дэу шевроле ЛАДА комплект 4 штуки;torch
ozon;726956571;"Комплект свечей зажигания TORCH K6RIU-11 IRIDIUM для ЛАДА (ВАЗ) 16 клапанов (так же для 8 клапанов); Chevrolet Lacetti, Aveo; Daewoo Nexia; Honda Civic";torch
ozon;1409238134;Иридиевые свечи зажигания SK20R-11 Тойота Лексус 1210;denso
ozon;1674718617;NGK IFR6T11 4589 Свечи зажигания иридиевые для Тойота Лексус Камри 30 40 Рав4 20 30 Королла 120 и другие (аналог Denso SK20R11), 4 шт.;ngk
ozon;846311203;Свечи зажигания TORCH K6RTCU-11 для LADA ВАЗ TOYOTA KIA NISSAN BRILLIANCE CHEVROLET DAEWOO FAW GREAT WALL KIA MERCEDES-BENZ MITSUBISHI SKODA SUBARU SUZUKI VW VOLVO AUDI ВАЗ 16кл ВАЗ 8кл КИА ДЭУ ШЕВРОЛЕ VOLVO AUDI ЛАДА КИА ДЭУ ШЕВРОЛЕ;torch
ozon;834833244;Свечи зажигания NGK BKR6E-11 комплект 4шт для CHEVROLET Aveo Lacetti / DAEWOO Nexia Lanos 1.5 / HONDA Civic Jazz / KIA/ для ВАЗ 8кл ВАЗ 16 кл Шевроле Авео Лачети Дэу Нексия Ланос Хонда Киа;ngk
ozon;1596966758;Свечи зажигания ngk bkr6e-11 комплект 4шт;bezBrenda
ozon;1287143772;Комплект свечей зажигания NGK BKR6E-11 для Aveo Lacetti Nexia, Lanos 1.5 / HONDA TOYOTA SUBARU MAZDA MITSUBISHI KIA / ВАЗ LADA 16 кл, Vesta Гранта и др;ngk
ozon;1165865781;Иридиевые свечи зажигания TORCH LD7RIU-11 M12x1,25x26.5 под 14 ключ для Nissan Renault Лада Веста X-ray (1.6 16V H4M HR16DE)Гранта(ВАЗ 11182) Duster/Kaptur/Fluence/Megane/Sandero/Logan (H4M) Juke Murano(от 2010) Teana VQ35DE(от 2008) Subaru FB20;torch
ozon;2701732294;Свечи зажигания DENSO Iridium SC16HR11 иридиевые 4 шт.;denso
ozon;1424512903;Свечи зажигания Тойота Королла 150, 140, 180 1.3 1.6, Авенсис T270 1.6, Рав 4 ха 30 ха 40 2.0, Мазда 3 3 (BK, BM) 1.5 2.0 Иридиевые SC20HR11 90919-01253 4шт.;toyota
ozon;1056043458;Иридиевые свечи зажигания TORCH K6RIU для LADA ВАЗ 16кл TOYOTA CHERY GEELY LIFAN CHANGAN SKODA KIA CHEVROLET BYD DONGFENG FAW GREAT WALL TIANMA OPEL,PEUGEOT NISSAN MITSUBISHI SUBARU RENAULT VOLVO VOLKSWAGEN BMW MERCEDES - BENZ Черри Джили Лифан Киа;torch
ozon;1394517256;Иридиевые свечи зажигания TORCH K6RIU IRIDIUM+U серия . ВАЗ 16 кл. Лада веста 1.6 Рено логан 1.6 Шевроле круз 1.6 Опель астра h Лансер 9 1.6;bezBrenda
ozon;1877918964;SPG018. Комплект иридиевых свечей зажигания RD5 на Mitsubishi Lancer Митсубиши Лансер, Outlander Оутлендер;rd5
ozon;1629003880;Наконечник рулевой 2 шт комплект Ford Focus 2-3 04-, Ford C-Max 03- / Наконечник рулевой комплект Форд фокус 2, фокус 3, Вольво Ц;zekkert
ozon;2791064404;Рулевые наконечники Форд Фокус 2-3, С Мах, / Рулевые наконечники Вольво С30, С70 II, S40 II, V50 / Передние левая - правая Комплект 2 шт. Zekkert;zekkert
ozon;1790863457;Рулевые наконечники Форд Фокус 2 комплект (правый+левый) GMB 2005-2008, Ford Focus 2 Рестайлинг 2008-2011;gmb
ozon;1696789471;Наконечник рулевой левый Hyundai Solaris, Kia Rio / Хендай Солярис, Киа Рио 568204L000;amd
ozon;1725515221;Наконечник рулевой правый Hyundai Solaris, Kia Rio / Хендай Солярис, Киа Рио 568204L090;amd
ozon;1784775988;"Наконечник рулевой (Комплект) Hyundai Solaris 10-16; Kia Rio 11-16, Киа Рио 2011-2017, Хендай Солярис 2011-2017 (Левый+Правый).";trt
ozon;2810115697;Рулевые наконечники Киа Рио 3 Хендай Солярис / Рулевые наконечники Kia Rio 3, Hyundai Solaris / Передние левая - правая Комплект 2 шт. Zekkert;zekkert
ozon;2538230786;"CTR Наконечник рулевой комплект Хендай Солярис, Киа Рио (11-17) / Hyundai Solaris, Kia Rio; 568204L090; CE0338R; CE0338L";ctr
ozon;3004513354;Набор фильтры масляный воздушный салонный для Лада Гранта (фл), Приора Калина, Ваз 2121 4х4 Легенд, Шевроле Нива. Комплект фильтров на Lada Granta (Fl), Priora Kalina, Niva 4x4 Legend, Chevrolet Niva;mavyko
ozon;806901544;Комплект/набор фильтров Калина, Гранта, Датсун ТО фильтр воздушный инжектор ВАЗ + масляный фильтр ВАЗ инжектор + салонный фильтр;briss
ozon;1250441713;Комплект фильтров Лада Калина 1, Лада Гранта, Датсун Он До (воздушный инжектор + салонный угольный + масляный);fortech
ozon;1184673031;Комплект фильтров для ТО Лада Гранта, Калина, Датсун он До, ми До 1.6, 82/87/90/98/106 л.с. / LADA Granta, Kalina, Datsun on-DO, mi-DO;iberis
ozon;2038895856;Комплект фильтров для Лада Гранта LADA Granta Калина Kalina CHEVROLET Niva;amd
ozon;3004517006;"Набор фильтры масляный воздушный салонный для Chery Tiggo T15 7; T18 8 Pro/Pro Max. Комплект фильтров на Чери Тигго Т15 7; Т18 8 Про/Про Мах";mavyko
ozon;1690133774;Комплект оригинальных фильтров для ТО Chery Tiggo 4 7 8 Pro Max 1.5 EXEED LX OMODA С5;bezBrenda
ozon;1612324249;Комплект фильтров для ТО CHERY 1.5.L Tiggo 4, 4 pro/ 7pro, 7 pro max/ 8, Omoda C5 EXEED LX Kaiyi X3 (Масляный, воздушный, салонный);chery
ozon;1884425567;Комплект оригинальных фильтров Chery Tiggo, Omoda C5;chery
ozon;1334872438;Набор фильтров для ТО CHERY Tiggo (4, 4 pro, 7 pro, 8) EXEED LX c 2018 по 2024 с двигателем 1.5т-147 л.с.;asin
ozon;3004518214;Набор фильтры масляный воздушный салонный для К4М Лада Ларгус, Ниссан Альмера G15, Рено Дастер 1, Логан, Сандеро. Комплект фильтров на K4M Lada Largus, Nissan Almera G15, Renault Duster Logan Sandero;mavyko
ozon;918628277;Комплект воздушный масляный салонный фильтры ЛАДА Ларгус РЕНО Дастер 1 Логан 1, Сандеро 1 к4м Набор для ТО Lada Largus Renault Duster Sandero K4M;rafFilter
ozon;1114569235;Комплект фильтров для ТО Рено Логан 2, Сандеро 2, 1.6, K7M 82 л.c. / Renault Logan 2, Sandero 2;iberis
ozon;2305659676;Комплект фильтров RENAULT Logan, Lada Largus (фильтр масляный, воздушный, салонный+прокладка сливной пробки)/ Набор для Рено Логан/Лада Ларгус;fortech
ozon;3004519293;Набор фильтры масляный, воздушный, салонный для вариаторной Лада Веста с 2019 г., Хрей с 2019 г. Комплект фильтров на Lada Vesta, Xray с корпусом воздушного фильтра нового образца 8450031940;mavyko
ozon;1173580699;Комплект воздушный масляный салонный угольный антибактериальный фильтры ЛАДА Веста 1.6 1 и ng от 07 2019 г в и Х Рей 1.6 двигатель 21129 от 2019- Набор для ТО Lada Vesta X-RAY Хрей;rafFilter
ozon;1181165936;Комплект фильтров для ТО Лада Веста, Икс Рей, 1.6/1.8, 21129/21179, 106/122 л.с. (с 08.2019г.) / LADA Vesta, X-Ray;iberis
ozon;782881031;BIG FILTER Комплект фильтров Лада Веста Икс-рей с двигателем ВАЗ / угольный салонный фильтр / GB102M / GB95090 / GB9978C (выпуск после 08.19);bigFilter
ozon;251759298;Комплект фильтров для Лада Веста LADA Vesta Xray после 06.2019-;amd
ozon;3004522614;Набор фильтры масляный, воздушный, салонный для вариаторной Лада Веста до 2019 г., Хрей до 2019 г. Комплект фильтров на Lada Vesta, Xray с корпусом воздушного фильтра 8450031940;mavyko
ozon;251756895;Комплект фильтров для Лада Веста LADA Vesta до -06.2019 Xray Иксрей;amd
ozon;1404583937;Комплект фильтров на LADA Vesta, Лада Веста, Lada Xrey, Лада Иксрей фильтр масляный, воздушный, салоный;rd5
ozon;3004529175;Набор передние диски тормозные серии PRO и колодки на R14 Для Лада Приора Гранта, Калина, Ваз 2110-2112. Комплект передних тормозных дисков и колодок на Lada Granta, Kalina, Priora;mavyko
ozon;1563731722;Комплект тормозных дисков R14 2шт + тормозные колодки Hofer Lada Приора Калина Гранта ВАЗ 2112, 2170, 2110-12, 1117-19, 2190-94 вентилируемый, с перфорацией 2112-3501070 HOFER HF 130 218;hofer
ozon;1674784397;Комплект тормозных дисков 2шт ваз ATC EuroSport R14 вентилируемые с перфорацией и проточками + тормозные колодки Hi-Q 4шт на ВАЗ 2112, Лада Приора, Калина, Гранта арт. 2112-05;ats
ozon;3004534460;Набор передние диски тормозные и колодки на Хендай Солярис 1/2, Киа Рио 3/4. Комплект передних тормозных дисков и колодок на Hyundai Solaris 1/2, Kia Rio 3/4;mavyko
ozon;1424929729;Комплект на переднюю ось: диски + тормозные колодки для Hyundai Solaris 1/2 и Kia Rio 3/4;sangsinBrake
ozon;1932847319;"Sangsi/Hi-Q Комплект: передние тормозные диски + колодки Солярис Рио SD1110; SP1399A 517120U000";sangsinBrake
ozon;2538216730;Комплект тормозных дисков передних с колодками Киа Рио Хендай Солярис , Kia Rio X-Line , Hyundai Solaris 581011RA00 517120U000;griffTech
ozon;3004536649;Набор задние диски тормозные и колодки на Хендай Солярис 1/2, Киа Рио 3/4. Комплект задних тормозных дисков и колодок на Hyundai Solaris 1/2, Kia Rio 3/4;mavyko
ozon;1425024325;Комплект на заднюю ось: диски + тормозные колодки для Hyundai Solaris и Kia Rio / Диск тормозной Солярис и Киа Рио;sangsinBrake
ozon;1932814386;Комплект тормозные диски колодки задние Хендай Солярис Киа Рио 11- / HYUNDAI SOLARIS KIA RIO 11- Sangsin/Hi-Q SD1087 SP1239;sangsinBrake
ozon;2538221068;Комплект тормозных дисков задних с колодками Киа Рио Хендай Солярис Kia Rio Hyundai Solaris 584110U300 583021RA30 583022HA50;griffTech
ozon;3007415075;Набор передние диски тормозные и колодки на R14 Для Лада Приора Гранта, Калина, Ваз 2110-2112. Комплект передних тормозных дисков и колодок на Lada Granta, Kalina, Priora;mavyko
ozon;2383756541;Комплект тормозных дисков R14 2шт + тормозные колодки Hofer Lada Приора Калина Гранта ВАЗ 2112, 2170, 2110-12, 1117-19, 2190-94 вентилируемый, 2112-3501070 HOFER HF 130 212;hofer
ozon;2748016449;Комплект BAPCO передних тормозных дисков 2 шт. BD0121 + колодки BP0022 для автомобиля R14 ВАЗ 2110-2112, Lada Granta/Kalina/Priora;bapco
ozon;3007420173;"Набор передние диски тормозные и колодки для Лада Ларгус, Веста; Ниссан Микра 3, Альмера G15; Рено Клио 3. Комплект тормозных дисков и колодок на Lada Largus, Vesta, Xray; Nissan Micra 3, Almera G15";mavyko
ozon;588408231;Диски тормозные с колодками передние комплект Riginal для а/м VESTA до 2023 годаLada Largus, Nissan Micra / Note, Renault Megane;riginal
ozon;1946160630;Комплект тормозных дисков и колодок (ZEKKERT) NISSAN MICRA/NOTE;zekkert
ozon;2065935991;Тормозные диски передние комплект и колодки керамические Лада Веста до 03.2023, Ларгус 16кл АБС,Альмера G15, Ниссан Ноут,Микра,Рено Меган 2 1.4 (фаза 2);miles
ozon;3007427166;Тормозные диски серии PRO и колодки передние для Лада Веста НГ 2022-, Искра 2025-/ Lada Vesta NG, Iskra OEM 8460013695 8450031577;mavyko
ozon;3007429775;Тормозные диски и колодки передние для Лада Веста, Ларгус K4M, Хрей, Ниссан Альмера G15, Ноут Е11, Тиида С11/ Lada Vesta, Largus, Nissan Almera G15, Note E11, Tiida C11/ 84500-31577 410608481R;mavyko
ozon;1829792507;Фильтр салонный угольный HONDA HR-V , Fit, StepWagon, Freed, Insight, Civic X, Vezel, CR-V V;honda
ozon;861645042;Just Drive Фильтр салонный Угольный арт. JDAC808EC для Fit 2-3-4, STEPWGN 5 RP!!!, Freed 1-2, Insight ZE, Civic 10, Vezel 1-2, CR-V 5 RW, CR-Z ZF 2009-2023гг. OEM: 80291-TF0-941 80291-TF3-E01 80292-TBA-A11 80292-TGL-E01 80291-T5A-J01 80291-T5R-A01 AC808EX, 1 шт.;justDrive
ozon;1319130966;Фильтр салонный угольный HONDA Fit 2-3, StepWagon 5, Freed, Insight, Civic 10, Vezel, CR-V 5, CR-Z 2009-2023 г. Just Drive арт. JDAC-808EC;justDrive
ozon;1254539431;Фильтр салонный со скосом для ВАЗ 2121, 21213, 21214, НИВА Урбан, Niva 4x4, Лада 4х4, Niva Legend;ru54
ozon;256006324;Фильтр салона для ВАЗ 2121, 21213, НИВА Урбан, Niva 4x4, Лада 4х4, Niva Legend;ru54
ozon;2859985189;"Фильтр салонный угольный для Тойота Камри xv40 xv50, Королла 150, Рав 4 30, Ленд Крузер (Прадо), Авенсис 3; Лексус. Фильтр салона Toyota Camry Corolla, Land Cruiser, Avensis, Rav 4, Avensis; Lexus rx";mavyko
ozon;720298078;Фильтр салонный 8713930040 для TOYOTA Camry Corolla Land Cruiser RAV4 LEXUS LX RX / ТОЙОТА Камри Королла Лэнд Крузер ЛЕКСУС LX RX;toyota
ozon;1284092662;Салонный фильтр угольный Тойота Королла 150, Рав 4;dashiwa
ozon;185880927;Фильтр салонный Toyota Тойота Avensis Авенсис, Camry Камри, Corolla Королла, HIACE, HILUX, Land Cruiser Ленд Круизер, CRUISER PRADO, RAV4 Рав4 8713930040;marshall
ozon;1826565846;Фильтр салонный угольный 8713950100 для TOYOTA Camry Corolla Land Cruiser RAV4 LEXUS LX RX / ТОЙОТА Камри Королла Лэнд Крузер ЛЕКСУС LX RX;toyota
ozon;2860045257;"Фильтр салонный пылевой Опель Астра J, Зафира С, Мокка Х, Инсигния Мерива; Шевроле Круз J300, Лачетти Авео Т300. Фильтр салона Opel Astra J, Mokka Zafira C, Insignia; Chevrolet Cruze Aveo T300 Orlando";mavyko
ozon;2194962176;Фильтр салонный CHEVROLET Cruze Orlando Volt Cobalt, OPEL Astra J Insignia Mokka Zafira C Meriva, RAVON R2 R4 FORTECH FS-038;fortech
ozon;546973869;"Салонный фильтр Опель Астра j, Ампера, Меррива, Мокка; Шевроле Авео, Круз, Кобальт, Малибу, Орландо, Фильтр салона OPEL Astra CHEVROLET Cruze 1 Orlando Spark 3 Tracker 3";rafFilter
ozon;195101135;Фильтр салонный Chevrolet Шевроле Aveo Авео, Cobalt Кобальт, Cruze Круз, Orlando Орландо, Spark Спарк, Opel Опель Astra Астра, Insignia Инсигния, MERIVA, Mokka Мокка, Zafira Зафира 13271191;marshall
ozon;2859980658;"Фильтр салонный пылевой для Тойота Камри xv40 xv50, Королла 150, Рав 4 30, Ленд Крузер (Прадо), Авенсис 3; Лексус. Фильтр салона Toyota Camry Corolla, Land Cruiser, Rav 4, Auris Avensis; Lexus rx";mavyko
ozon;1341190774;Toyota Фильтр салонный Пылевой арт. 87139-YZZ16, 1 шт.;toyota
ozon;2859895476;"Фильтр салонный угольный на Киа Рио 4 (Х-лайн), Спортейдж 4; Хендай Солярис 2 (Акцент 4), Крета Туксон 3; Фильтр салона Kia Rio 4 (Xline), Sportage 4; Hyundai Solaris 2, Creta Tucson/ OEM 97133D1000";mavyko
ozon;1239625701;Фильтр салонный угольный Киа Рио 4, Киа Рио Х лайн, Хендай Крета 1.6, 2.0, 97133d1000 hyundai;dashiwa
ozon;1624232201;Фильтр салонный угольный Hyundai, Creta 2, Solaris 2, Kia Rio 4, Sportage4, Хендай, хундай солярис 2, крета, киа, кия рио, фильтр в салон;stlFilter
ozon;2195343926;Фильтр салонный угольный Hyundai Creta Solaris II Tucson, KIA Rio 4 X-Line, Seltos, Sportage, Solaris HS KRX FORTECH FS-150С;fortech
ozon;2859838555;"Фильтр салонный пылевой для Киа Рио 3 2011-2017, Хендай Солярис 1 1.4 1.6 2011-2017; Фильтр салона Kia Rio (UB) 3, Hyundai Solaris (RB) 1 / OEM 971334L000 971332H001 97133F2100";mavyko
ozon;2710673956;Фильтр салонный KIA RIO 3 (2011-2017), Hyundai Solaris I (2010-2017) NAC 7794-ST;nac
ozon;1309733458;"Фильтр салонный KIA RIO 3 (2011-2017), Hyundai Solaris I (2010-2017) ""FORTECH"" FS-130";fortech
ozon;185907862;Фильтр салонный Hyundai Хендай Solaris Солярис, Kia Киа Rio Рио 971334L000;marshall
ozon;2859856383;"Фильтр салонный угольный для Киа Рио 3 2011-2017, Хендай Солярис 1 1.4 1.6 2011-2017; Фильтр салона Kia Rio (UB) 3, Hyundai Solaris (RB) 1 / OEM 971334L000 971332H001 97133F2100";mavyko
ozon;1146203574;Фильтр салонный угольный RD5 KIA Rio 3 (UB) 2011 - 2017, Киа Рио 3, HUYNDAI Solaris 3 (RB) 2011 2017 Хендай Солярис;rd5
ozon;198076031;Фильтр салонный угольный Hyundai Хендай Solaris Солярис, Kia Киа Rio Рио S971334L000;marshall
ozon;1404623362;Салонный фильтр угольный Хендай Солярис 1.6, Kia Rio 3, 971334l000;dashiwa
ozon;2860059411;"Воздушный фильтр для Киа Рио 4 (Х-лайн) 1.4, 1.6; Хендай Солярис 2, Акцент 4. Kia Rio IV (X-line) 2017-; Hyundai Solaris II (HC) 2017-, Accent IV / OEM 28113H8100 28113-H8100";mavyko
ozon;2010793989;Фильтр воздушный бумажный Солярис 2, Киа Рио 4 (X-Line), Солярис HS, Солярис KRX FORTECH FA-250-P;fortech
ozon;884499373;Фильтр воздушный RD5 HYUNDAI Solaris c 01.2017-, KIA RIO 4 c 07.2017-, Солярис, Киа Рио;rd5
ozon;275314756;Фильтр воздушный Hyundai Хендай Solaris Солярис, Kia Киа Rio Рио 28113H8100;marshall
ozon;2748195069;Фильтр воздушный MIGMA для Hyundai Solaris 2 с 01.2017- 1.4, 1.6, Kia Rio с 02.2017- 1.4, 1.6 (X-Line) OEM 28113H8100;migma
ozon;2766517380;TSN Колодки тормозные дисковые передние HYUNDAI Solaris I (2010-2017г.), KIA-Rio III (2011-2017) (к-т 4 шт);tsn
ozon;788373644;Колодки тормозные передние Hyundai Solaris 2, Kia Rio4, Geely Atlas,JBP0318.;justDrive
ozon;1935133507;Тормозные колодки передние Hyundai Solaris I/Kia Rio III 4 шт Колодки тормозные дисковые передние Хендай Солярис, Киа Рио;mvaa
ozon;2588995471;Колодки тормозные передние Киа Рио, Солярис;amd
ozon;1851216175;Колодки тормозные передние ВАЗ 2108 2109 2110 2112 2114 2115, Приора , Гранта Калина, Datsun on-do Datsun mi-do БЕКО Opигинaл;tormoznыeKolodkyBekoToliatty
ozon;1725535161;Колодки тормозные передние HOFER, ВАЗ 2108, 2109, 2110 2112 2114 2115, LADA Гранта, Приора, Калина, Datsun;hofer
ozon;2695749741;Тормозные колодки передние BP0022 Лада Гранта, Приора, Калина, ВАЗ 2108 2109 2110 2112 2114 2115, Datsun, Bapco BP0022;bapco
ozon;2265473142;Колодки тормозные передние Гранта Калина Приора Датсун ВАЗ 2108-2115 BARNETT LD004S;barnett
ozon;2187706268;Колодки тормозные передние BARNETT LD007S;barnett
ozon;1545659134;Колодки тормозные передние Micra, Nissan Note,Tiida,LADA VESTA NG (2023-),JBP0019.88,543 ч;justDrive
ozon;1852738283;Тормозные колодки задние HI Q SP1823 на Lada Vesta/Веста (задние дисковые тормоза);sangsinBrake
ozon;1147154779;Тормозные колодки задние дисковые HOFER HF350960 для а/м Лада 1118, 2190 sport, Vesta SW/SW Cross;hofer
ozon;1844048651;"Колодки тормозные задние ""LADA Vesta, 1118, 2190"" дисковые ""ADR""";adr
ozon;2588989257;Колодки тормозные задние Солярис, Киа Рио;amd
ozon;2515683179;DINOZAVR, Тормозные колодки дисковые ( задние ) Changan CS35 Hyundai ХЕНДАЙ i30 Solaris Солярис и Geely Джили Atlas Атлас PRO Emgrand Эмгранд GS и Kia КИА CADENZA Сид Церато, GDB3494 583021RA30.;dinozavr
ozon;1418156336;RDM Колодки тормозные барабанные Задние, арт. 2101-3502090 , ВАЗ 2101-2107, Нива Шевроле, 4х4, Лада 2121, 2123, Урбан, URBAN, Шеви, Шевролет, Шевроле, Chevrolet;rdm
ozon;1670244885;Колодки тормозные Задние ВАЗ 2101 2102 2104 2105 2106 2107 2121 2123 НИВА Chevrolet Niva;raider
ozon;1784749594;Тормозные колодки задние Начало для ВАЗ 2101-2107, Нива, Шевроле Нива арт. 2101-3502090;nachalo
ozon;1418374565;RDM Колодки тормозные барабанные Задние, На стояночный тормоз, арт. 21080-3502090-86;rdm
ozon;1958783777;Raider Колодки тормозные барабанные Задние, На стояночный тормоз, арт. колодки задние ваз 2114;raider
ozon;2951245719;Колодки тормозные задние без ABS Комплект с пружинами Ваз 2108-2115 Калина Приора Гранта Датсун (HOFER);hofer
ozon;1421011875;Тормозные колодки задние барабанные HOFER HF350964 для а/м Renault Logan, LADA Xray;hofer
ozon;1524372288;"Колодки тормозные Lada Xray; Renault Logan 04- (Bosch), Nissan; Peugeot барабанные 203 х 38 ST";supportTechnology
ozon;1124466185;Колодка тормозная задняя барабанная (к-т. 4шт.) Riginal для а/м Renault Logan, Sandero 2004, Peugeot 206, 203 мм с-ма TRW;riginal
ozon;2762335276;TSN Колодки тормозные дисковые передние Lada Largus,VESTA RENAULT Logan, Sandero, Symbol NISSAN Almera 3 (к-т 4 шт);tsn
